scripts/benchmark/clblast_xgemm_1_32.json
{
  "kernel_family": "xgemm_1",
  "precision": "32",
  "best_kernel": "Xgemm",
  "best_time": "1.08",
  "best_parameters": "GEMMK=0 KREG=1 KWG=32 KWI=2 MDIMA=8 MDIMC=8 MWG=16 NDIMB=16 NDIMC=16 NWG=32 PRECISION=32 SA=0 SB=0 STRM=0 STRN=0 VWM=2 VWN=2",
  "arg_m": "1024",
  "arg_n": "1024",
  "arg_k": "1024",
  "arg_alpha": "2.00",
  "arg_beta": "2.00",
  "clblast_device_type": "GPU",
  "clblast_device_vendor": "Apple",
  "clblast_device_architecture": "",
  "clblast_device_name": "Apple M1 Max",
  "device": "Apple M1 Max",
  "platform_vendor": "Apple",
  "platform_version": "OpenCL 1.2 (Jun 23 2023 20:24:12)",
  "device_vendor": "Apple",
  "device_type": "GPU",
  "device_core_clock": "1000",
  "device_compute_units": "32",
  "device_extra_info": "",
  "results": [
    {
      "kernel": "Xgemm",
      "time": 2.328,
      "parameters": {"GEMMK": 0,"KREG": 1,"KWG": 32,"KWI": 2,"MDIMA": 8,"MDIMC": 8,"MWG": 16,"NDIMB": 8,"NDIMC": 8,"NWG": 16,"PRECISION": 32,"SA": 0,"SB": 0,"STRM": 0,"STRN": 0,"VWM": 1,"VWN": 1}
    },
    {
      "kernel": "Xgemm",
      "time": 3.212,
      "parameters": {"GEMMK": 0,"KREG": 1,"KWG": 32,"KWI": 2,"MDIMA": 8,"MDIMC": 8,"MWG": 16,"NDIMB": 8,"NDIMC": 8,"NWG": 16,"PRECISION": 32,"SA": 1,"SB": 1,"STRM": 0,"STRN": 0,"VWM": 1,"VWN": 1}
    },
    {
      "kernel": "Xgemm",
      "time": 3.811,
      "parameters": {"GEMMK": 0,"KREG": 1,"KWG": 32,"KWI": 2,"MDIMA": 8,"MDIMC": 8,"MWG": 16,"NDIMB": 8,"NDIMC": 8,"NWG": 16,"PRECISION": 32,"SA": 0,"SB": 0,"STRM": 0,"STRN": 0,"VWM": 1,"VWN": 2}
    },
    {
      "kernel": "Xgemm",
      "time": 3.686,
      "parameters": {"GEMMK": 0,"KREG": 1,"KWG": 32,"KWI": 2,"MDIMA": 8,"MDIMC": 8,"MWG": 16,"NDIMB": 8,"NDIMC": 8,"NWG": 16,"PRECISION": 32,"SA": 1,"SB": 1,"STRM": 0,"STRN": 0,"VWM": 1,"VWN": 2}
    },
    {
      "kernel": "Xgemm",
      "time": 3.743,
      "parameters": {"GEMMK": 0,"KREG": 1,"KWG": 32,"KWI": 2,"MDIMA": 8,"MDIMC": 8,"MWG": 16,"NDIMB": 8,"NDIMC": 8,"NWG": 16,"PRECISION": 32,"SA": 0,"SB": 0,"STRM": 0,"STRN": 0,"VWM": 2,"VWN": 1}
    },
    {
      "kernel": "Xgemm",
      "time": 3.671,
      "parameters": {"GEMMK": 0,"KREG": 1,"KWG": 32,"KWI": 2,"MDIMA": 8,"MDIMC": 8,"MWG": 16,"NDIMB": 8,"NDIMC": 8,"NWG": 16,"PRECISION": 32,"SA": 1,"SB": 1,"STRM": 0,"STRN": 0,"VWM": 2,"VWN": 1}
    },
    {
      "kernel": "Xgemm",
      "time": 1.078,
      "parameters": {"GEMMK": 0,"KREG": 1,"KWG": 32,"KWI": 2,"MDIMA": 8,"MDIMC": 8,"MWG": 16,"NDIMB": 8,"NDIMC": 8,"NWG": 16,"PRECISION": 32,"SA": 0,"SB": 0,"STRM": 0,"STRN": 0,"VWM": 2,"VWN": 2}
    },
    {
      "kernel": "Xgemm",
      "time": 3.247,
      "parameters": {"GEMMK": 0,"KREG": 1,"KWG": 32,"KWI": 2,"MDIMA": 8,"MDIMC": 8,"MWG": 16,"NDIMB": 8,"NDIMC": 8,"NWG": 16,"PRECISION": 32,"SA": 1,"SB": 1,"STRM": 0,"STRN": 0,"VWM": 2,"VWN": 2}
    },
    {
      "kernel": "Xgemm",
      "time": 5.316,
      "parameters": {"GEMMK": 0,"KREG": 1,"KWG": 32,"KWI": 2,"MDIMA": 8,"MDIMC": 8,"MWG": 16,"NDIMB": 16,"NDIMC": 16,"NWG": 16,"PRECISION": 32,"SA": 0,"SB": 0,"STRM": 0,"STRN": 0,"VWM": 1,"VWN": 1}
    },
    {
      "kernel": "Xgemm",
      "time": 2.010,
      "parameters": {"GEMMK": 0,"KREG": 1,"KWG": 32,"KWI": 2,"MDIMA": 8,"MDIMC": 8,"MWG": 16,"NDIMB": 16,"NDIMC": 16,"NWG": 16,"PRECISION": 32,"SA": 1,"SB": 1,"STRM": 0,"STRN": 0,"VWM": 1,"VWN": 1}
    },
    {
      "kernel": "Xgemm",
      "time": 4.179,
      "parameters": {"GEMMK": 0,"KREG": 1,"KWG": 32,"KWI": 2,"MDIMA": 8,"MDIMC": 8,"MWG": 16,"NDIMB": 16,"NDIMC": 16,"NWG": 16,"PRECISION": 32,"SA": 0,"SB": 0,"STRM": 0,"STRN": 0,"VWM": 2,"VWN": 1}
    },
    {
      "kernel": "Xgemm",
      "time": 4.540,
      "parameters": {"GEMMK": 0,"KREG": 1,"KWG": 32,"KWI": 2,"MDIMA": 8,"MDIMC": 8,"MWG": 16,"NDIMB": 16,"NDIMC": 16,"NWG": 16,"PRECISION": 32,"SA": 1,"SB": 1,"STRM": 0,"STRN": 0,"VWM": 2,"VWN": 1}
    },
    {
      "kernel": "Xgemm",
      "time": 2.749,
      "parameters": {"GEMMK": 0,"KREG": 1,"KWG": 32,"KWI": 2,"MDIMA": 16,"MDIMC": 16,"MWG": 16,"NDIMB": 8,"NDIMC": 8,"NWG": 16,"PRECISION": 32,"SA": 0,"SB": 0,"STRM": 0,"STRN": 0,"VWM": 1,"VWN": 1}
    },
    {
      "kernel": "Xgemm",
      "time": 2.361,
      "parameters": {"GEMMK": 0,"KREG": 1,"KWG": 32,"KWI": 2,"MDIMA": 16,"MDIMC": 16,"MWG": 16,"NDIMB": 8,"NDIMC": 8,"NWG": 16,"PRECISION": 32,"SA": 1,"SB": 1,"STRM": 0,"STRN": 0,"VWM": 1,"VWN": 1}
    },
    {
      "kernel": "Xgemm",
      "time": 3.777,
      "parameters": {"GEMMK": 0,"KREG": 1,"KWG": 32,"KWI": 2,"MDIMA": 16,"MDIMC": 16,"MWG": 16,"NDIMB": 8,"NDIMC": 8,"NWG": 16,"PRECISION": 32,"SA": 0,"SB": 0,"STRM": 0,"STRN": 0,"VWM": 1,"VWN": 2}
    },
    {
      "kernel": "Xgemm",
      "time": 4.684,
      "parameters": {"GEMMK": 0,"KREG": 1,"KWG": 32,"KWI": 2,"MDIMA": 16,"MDIMC": 16,"MWG": 16,"NDIMB": 8,"NDIMC": 8,"NWG": 16,"PRECISION": 32,"SA": 1,"SB": 1,"STRM": 0,"STRN": 0,"VWM": 1,"VWN": 2}
    },
    {
      "kernel": "Xgemm",
      "time": 2.715,
      "parameters": {"GEMMK": 0,"KREG": 1,"KWG": 32,"KWI": 2,"MDIMA": 16,"MDIMC": 16,"MWG": 16,"NDIMB": 16,"NDIMC": 16,"NWG": 16,"PRECISION": 32,"SA": 0,"SB": 0,"STRM": 0,"STRN": 0,"VWM": 1,"VWN": 1}
    },
    {
      "kernel": "Xgemm",
      "time": 2.389,
      "parameters": {"GEMMK": 0,"KREG": 1,"KWG": 32,"KWI": 2,"MDIMA": 16,"MDIMC": 16,"MWG": 16,"NDIMB": 16,"NDIMC": 16,"NWG": 16,"PRECISION": 32,"SA": 1,"SB": 1,"STRM": 0,"STRN": 0,"VWM": 1,"VWN": 1}
    },
    {
      "kernel": "Xgemm",
      "time": 2.821,
      "parameters": {"GEMMK": 0,"KREG": 1,"KWG": 32,"KWI": 2,"MDIMA": 8,"MDIMC": 8,"MWG": 16,"NDIMB": 8,"NDIMC": 8,"NWG": 32,"PRECISION": 32,"SA": 0,"SB": 0,"STRM": 0,"STRN": 0,"VWM": 1,"VWN": 1}
    },
    {
      "kernel": "Xgemm",
      "time": 2.948,
      "parameters": {"GEMMK": 0,"KREG": 1,"KWG": 32,"KWI": 2,"MDIMA": 8,"MDIMC": 8,"MWG": 16,"NDIMB": 8,"NDIMC": 8,"NWG": 32,"PRECISION": 32,"SA": 1,"SB": 1,"STRM": 0,"STRN": 0,"VWM": 1,"VWN": 1}
    },
    {
      "kernel": "Xgemm",
      "time": 3.792,
      "parameters": {"GEMMK": 0,"KREG": 1,"KWG": 32,"KWI": 2,"MDIMA": 8,"MDIMC": 8,"MWG": 16,"NDIMB": 8,"NDIMC": 8,"NWG": 32,"PRECISION": 32,"SA": 0,"SB": 0,"STRM": 0,"STRN": 0,"VWM": 1,"VWN": 2}
    },
    {
      "kernel": "Xgemm",
      "time": 2.756,
      "parameters": {"GEMMK": 0,"KREG": 1,"KWG": 32,"KWI": 2,"MDIMA": 8,"MDIMC": 8,"MWG": 16,"NDIMB": 8,"NDIMC": 8,"NWG": 32,"PRECISION": 32,"SA": 1,"SB": 1,"STRM": 0,"STRN": 0,"VWM": 1,"VWN": 2}
    },
    {
      "kernel": "Xgemm",
      "time": 3.675,
      "parameters": {"GEMMK": 0,"KREG": 1,"KWG": 32,"KWI": 2,"MDIMA": 8,"MDIMC": 8,"MWG": 16,"NDIMB": 8,"NDIMC": 8,"NWG": 32,"PRECISION": 32,"SA": 0,"SB": 0,"STRM": 0,"STRN": 0,"VWM": 1,"VWN": 4}
    },
    {
      "kernel": "Xgemm",
      "time": 2.865,
      "parameters": {"GEMMK": 0,"KREG": 1,"KWG": 32,"KWI": 2,"MDIMA": 8,"MDIMC": 8,"MWG": 16,"NDIMB": 8,"NDIMC": 8,"NWG": 32,"PRECISION": 32,"SA": 1,"SB": 1,"STRM": 0,"STRN": 0,"VWM": 1,"VWN": 4}
    },
    {
      "kernel": "Xgemm",
      "time": 3.158,
      "parameters": {"GEMMK": 0,"KREG": 1,"KWG": 32,"KWI": 2,"MDIMA": 8,"MDIMC": 8,"MWG": 16,"NDIMB": 8,"NDIMC": 8,"NWG": 32,"PRECISION": 32,"SA": 0,"SB": 0,"STRM": 0,"STRN": 0,"VWM": 2,"VWN": 1}
    },
    {
      "kernel": "Xgemm",
      "time": 1.574,
      "parameters": {"GEMMK": 0,"KREG": 1,"KWG": 32,"KWI": 2,"MDIMA": 8,"MDIMC": 8,"MWG": 16,"NDIMB": 8,"NDIMC": 8,"NWG": 32,"PRECISION": 32,"SA": 1,"SB": 1,"STRM": 0,"STRN": 0,"VWM": 2,"VWN": 1}
    },
    {
      "kernel": "Xgemm",
      "time": 3.382,
      "parameters": {"GEMMK": 0,"KREG": 1,"KWG": 32,"KWI": 2,"MDIMA": 8,"MDIMC": 8,"MWG": 16,"NDIMB": 8,"NDIMC": 8,"NWG": 32,"PRECISION": 32,"SA": 0,"SB": 0,"STRM": 0,"STRN": 0,"VWM": 2,"VWN": 2}
    },
    {
      "kernel": "Xgemm",
      "time": 1.814,
      "parameters": {"GEMMK": 0,"KREG": 1,"KWG": 32,"KWI": 2,"MDIMA": 8,"MDIMC": 8,"MWG": 16,"NDIMB": 8,"NDIMC": 8,"NWG": 32,"PRECISION": 32,"SA": 1,"SB": 1,"STRM": 0,"STRN": 0,"VWM": 2,"VWN": 2}
    },
    {
      "kernel": "Xgemm",
      "time": 1.908,
      "parameters": {"GEMMK": 0,"KREG": 1,"KWG": 32,"KWI": 2,"MDIMA": 8,"MDIMC": 8,"MWG": 16,"NDIMB": 8,"NDIMC": 8,"NWG": 32,"PRECISION": 32,"SA": 0,"SB": 0,"STRM": 0,"STRN": 0,"VWM": 2,"VWN": 4}
    },
    {
      "kernel": "Xgemm",
      "time": 2.146,
      "parameters": {"GEMMK": 0,"KREG": 1,"KWG": 32,"KWI": 2,"MDIMA": 8,"MDIMC": 8,"MWG": 16,"NDIMB": 8,"NDIMC": 8,"NWG": 32,"PRECISION": 32,"SA": 1,"SB": 1,"STRM": 0,"STRN": 0,"VWM": 2,"VWN": 4}
    },
    {
      "kernel": "Xgemm",
      "time": 2.252,
      "parameters": {"GEMMK": 0,"KREG": 1,"KWG": 32,"KWI": 2,"MDIMA": 8,"MDIMC": 8,"MWG": 16,"NDIMB": 16,"NDIMC": 16,"NWG": 32,"PRECISION": 32,"SA": 0,"SB": 0,"STRM": 0,"STRN": 0,"VWM": 1,"VWN": 1}
    },
    {
      "kernel": "Xgemm",
      "time": 2.172,
      "parameters": {"GEMMK": 0,"KREG": 1,"KWG": 32,"KWI": 2,"MDIMA": 8,"MDIMC": 8,"MWG": 16,"NDIMB": 16,"NDIMC": 16,"NWG": 32,"PRECISION": 32,"SA": 1,"SB": 1,"STRM": 0,"STRN": 0,"VWM": 1,"VWN": 1}
    },
    {
      "kernel": "Xgemm",
      "time": 2.322,
      "parameters": {"GEMMK": 0,"KREG": 1,"KWG": 32,"KWI": 2,"MDIMA": 8,"MDIMC": 8,"MWG": 16,"NDIMB": 16,"NDIMC": 16,"NWG": 32,"PRECISION": 32,"SA": 0,"SB": 0,"STRM": 0,"STRN": 0,"VWM": 1,"VWN": 2}
    },
    {
      "kernel": "Xgemm",
      "time": 2.947,
      "parameters": {"GEMMK": 0,"KREG": 1,"KWG": 32,"KWI": 2,"MDIMA": 8,"MDIMC": 8,"MWG": 16,"NDIMB": 16,"NDIMC": 16,"NWG": 32,"PRECISION": 32,"SA": 1,"SB": 1,"STRM": 0,"STRN": 0,"VWM": 1,"VWN": 2}
    },
    {
      "kernel": "Xgemm",
      "time": 3.804,
      "parameters": {"GEMMK": 0,"KREG": 1,"KWG": 32,"KWI": 2,"MDIMA": 8,"MDIMC": 8,"MWG": 16,"NDIMB": 16,"NDIMC": 16,"NWG": 32,"PRECISION": 32,"SA": 0,"SB": 0,"STRM": 0,"STRN": 0,"VWM": 2,"VWN": 1}
    },
    {
      "kernel": "Xgemm",
      "time": 3.817,
      "parameters": {"GEMMK": 0,"KREG": 1,"KWG": 32,"KWI": 2,"MDIMA": 8,"MDIMC": 8,"MWG": 16,"NDIMB": 16,"NDIMC": 16,"NWG": 32,"PRECISION": 32,"SA": 1,"SB": 1,"STRM": 0,"STRN": 0,"VWM": 2,"VWN": 1}
    },
    {
      "kernel": "Xgemm",
      "time": 1.077,
      "parameters": {"GEMMK": 0,"KREG": 1,"KWG": 32,"KWI": 2,"MDIMA": 8,"MDIMC": 8,"MWG": 16,"NDIMB": 16,"NDIMC": 16,"NWG": 32,"PRECISION": 32,"SA": 0,"SB": 0,"STRM": 0,"STRN": 0,"VWM": 2,"VWN": 2}
    },
    {
      "kernel": "Xgemm",
      "time": 3.345,
      "parameters": {"GEMMK": 0,"KREG": 1,"KWG": 32,"KWI": 2,"MDIMA": 8,"MDIMC": 8,"MWG": 16,"NDIMB": 16,"NDIMC": 16,"NWG": 32,"PRECISION": 32,"SA": 1,"SB": 1,"STRM": 0,"STRN": 0,"VWM": 2,"VWN": 2}
    },
    {
      "kernel": "Xgemm",
      "time": 4.998,
      "parameters": {"GEMMK": 0,"KREG": 1,"KWG": 32,"KWI": 2,"MDIMA": 8,"MDIMC": 8,"MWG": 16,"NDIMB": 32,"NDIMC": 32,"NWG": 32,"PRECISION": 32,"SA": 0,"SB": 0,"STRM": 0,"STRN": 0,"VWM": 1,"VWN": 1}
    },
    {
      "kernel": "Xgemm",
      "time": 2.818,
      "parameters": {"GEMMK": 0,"KREG": 1,"KWG": 32,"KWI": 2,"MDIMA": 8,"MDIMC": 8,"MWG": 16,"NDIMB": 32,"NDIMC": 32,"NWG": 32,"PRECISION": 32,"SA": 1,"SB": 1,"STRM": 0,"STRN": 0,"VWM": 1,"VWN": 1}
    },
    {
      "kernel": "Xgemm",
      "time": 4.187,
      "parameters": {"GEMMK": 0,"KREG": 1,"KWG": 32,"KWI": 2,"MDIMA": 8,"MDIMC": 8,"MWG": 16,"NDIMB": 32,"NDIMC": 32,"NWG": 32,"PRECISION": 32,"SA": 0,"SB": 0,"STRM": 0,"STRN": 0,"VWM": 2,"VWN": 1}
    },
    {
      "kernel": "Xgemm",
      "time": 4.943,
      "parameters": {"GEMMK": 0,"KREG": 1,"KWG": 32,"KWI": 2,"MDIMA": 8,"MDIMC": 8,"MWG": 16,"NDIMB": 32,"NDIMC": 32,"NWG": 32,"PRECISION": 32,"SA": 1,"SB": 1,"STRM": 0,"STRN": 0,"VWM": 2,"VWN": 1}
    },
    {
      "kernel": "Xgemm",
      "time": 2.091,
      "parameters": {"GEMMK": 0,"KREG": 1,"KWG": 32,"KWI": 2,"MDIMA": 16,"MDIMC": 16,"MWG": 16,"NDIMB": 8,"NDIMC": 8,"NWG": 32,"PRECISION": 32,"SA": 0,"SB": 0,"STRM": 0,"STRN": 0,"VWM": 1,"VWN": 1}
    },
    {
      "kernel": "Xgemm",
      "time": 2.247,
      "parameters": {"GEMMK": 0,"KREG": 1,"KWG": 32,"KWI": 2,"MDIMA": 16,"MDIMC": 16,"MWG": 16,"NDIMB": 8,"NDIMC": 8,"NWG": 32,"PRECISION": 32,"SA": 1,"SB": 1,"STRM": 0,"STRN": 0,"VWM": 1,"VWN": 1}
    },
    {
      "kernel": "Xgemm",
      "time": 1.976,
      "parameters": {"GEMMK": 0,"KREG": 1,"KWG": 32,"KWI": 2,"MDIMA": 16,"MDIMC": 16,"MWG": 16,"NDIMB": 8,"NDIMC": 8,"NWG": 32,"PRECISION": 32,"SA": 0,"SB": 0,"STRM": 0,"STRN": 0,"VWM": 1,"VWN": 2}
    },
    {
      "kernel": "Xgemm",
      "time": 2.129,
      "parameters": {"GEMMK": 0,"KREG": 1,"KWG": 32,"KWI": 2,"MDIMA": 16,"MDIMC": 16,"MWG": 16,"NDIMB": 8,"NDIMC": 8,"NWG": 32,"PRECISION": 32,"SA": 1,"SB": 1,"STRM": 0,"STRN": 0,"VWM": 1,"VWN": 2}
    },
    {
      "kernel": "Xgemm",
      "time": 3.225,
      "parameters": {"GEMMK": 0,"KREG": 1,"KWG": 32,"KWI": 2,"MDIMA": 16,"MDIMC": 16,"MWG": 16,"NDIMB": 8,"NDIMC": 8,"NWG": 32,"PRECISION": 32,"SA": 0,"SB": 0,"STRM": 0,"STRN": 0,"VWM": 1,"VWN": 4}
    },
    {
      "kernel": "Xgemm",
      "time": 3.336,
      "parameters": {"GEMMK": 0,"KREG": 1,"KWG": 32,"KWI": 2,"MDIMA": 16,"MDIMC": 16,"MWG": 16,"NDIMB": 8,"NDIMC": 8,"NWG": 32,"PRECISION": 32,"SA": 1,"SB": 1,"STRM": 0,"STRN": 0,"VWM": 1,"VWN": 4}
    },
    {
      "kernel": "Xgemm",
      "time": 5.376,
      "parameters": {"GEMMK": 0,"KREG": 1,"KWG": 32,"KWI": 2,"MDIMA": 16,"MDIMC": 16,"MWG": 16,"NDIMB": 16,"NDIMC": 16,"NWG": 32,"PRECISION": 32,"SA": 0,"SB": 0,"STRM": 0,"STRN": 0,"VWM": 1,"VWN": 1}
    },
    {
      "kernel": "Xgemm",
      "time": 5.188,
      "parameters": {"GEMMK": 0,"KREG": 1,"KWG": 32,"KWI": 2,"MDIMA": 16,"MDIMC": 16,"MWG": 16,"NDIMB": 16,"NDIMC": 16,"NWG": 32,"PRECISION": 32,"SA": 1,"SB": 1,"STRM": 0,"STRN": 0,"VWM": 1,"VWN": 1}
    },
    {
      "kernel": "Xgemm",
      "time": 4.768,
      "parameters": {"GEMMK": 0,"KREG": 1,"KWG": 32,"KWI": 2,"MDIMA": 16,"MDIMC": 16,"MWG": 16,"NDIMB": 16,"NDIMC": 16,"NWG": 32,"PRECISION": 32,"SA": 0,"SB": 0,"STRM": 0,"STRN": 0,"VWM": 1,"VWN": 2}
    },
    {
      "kernel": "Xgemm",
      "time": 1.868,
      "parameters": {"GEMMK": 0,"KREG": 1,"KWG": 32,"KWI": 2,"MDIMA": 16,"MDIMC": 16,"MWG": 16,"NDIMB": 16,"NDIMC": 16,"NWG": 32,"PRECISION": 32,"SA": 1,"SB": 1,"STRM": 0,"STRN": 0,"VWM": 1,"VWN": 2}
    },
    {
      "kernel": "Xgemm",
      "time": 3.747,
      "parameters": {"GEMMK": 0,"KREG": 1,"KWG": 32,"KWI": 2,"MDIMA": 8,"MDIMC": 8,"MWG": 16,"NDIMB": 8,"NDIMC": 8,"NWG": 64,"PRECISION": 32,"SA": 0,"SB": 0,"STRM": 0,"STRN": 0,"VWM": 1,"VWN": 1}
    },
    {
      "kernel": "Xgemm",
      "time": 2.802,
      "parameters": {"GEMMK": 0,"KREG": 1,"KWG": 32,"KWI": 2,"MDIMA": 8,"MDIMC": 8,"MWG": 16,"NDIMB": 8,"NDIMC": 8,"NWG": 64,"PRECISION": 32,"SA": 1,"SB": 1,"STRM": 0,"STRN": 0,"VWM": 1,"VWN": 1}
    },
    {
      "kernel": "Xgemm",
      "time": 2.001,
      "parameters": {"GEMMK": 0,"KREG": 1,"KWG": 32,"KWI": 2,"MDIMA": 8,"MDIMC": 8,"MWG": 16,"NDIMB": 8,"NDIMC": 8,"NWG": 64,"PRECISION": 32,"SA": 0,"SB": 0,"STRM": 0,"STRN": 0,"VWM": 1,"VWN": 2}
    },
    {
      "kernel": "Xgemm",
      "time": 3.202,
      "parameters": {"GEMMK": 0,"KREG": 1,"KWG": 32,"KWI": 2,"MDIMA": 8,"MDIMC": 8,"MWG": 16,"NDIMB": 8,"NDIMC": 8,"NWG": 64,"PRECISION": 32,"SA": 1,"SB": 1,"STRM": 0,"STRN": 0,"VWM": 1,"VWN": 2}
    },
    {
      "kernel": "Xgemm",
      "time": 3.793,
      "parameters": {"GEMMK": 0,"KREG": 1,"KWG": 32,"KWI": 2,"MDIMA": 8,"MDIMC": 8,"MWG": 16,"NDIMB": 8,"NDIMC": 8,"NWG": 64,"PRECISION": 32,"SA": 0,"SB": 0,"STRM": 0,"STRN": 0,"VWM": 1,"VWN": 4}
    },
    {
      "kernel": "Xgemm",
      "time": 3.127,
      "parameters": {"GEMMK": 0,"KREG": 1,"KWG": 32,"KWI": 2,"MDIMA": 8,"MDIMC": 8,"MWG": 16,"NDIMB": 8,"NDIMC": 8,"NWG": 64,"PRECISION": 32,"SA": 1,"SB": 1,"STRM": 0,"STRN": 0,"VWM": 1,"VWN": 4}
    },
    {
      "kernel": "Xgemm",
      "time": 3.806,
      "parameters": {"GEMMK": 0,"KREG": 1,"KWG": 32,"KWI": 2,"MDIMA": 8,"MDIMC": 8,"MWG": 16,"NDIMB": 8,"NDIMC": 8,"NWG": 64,"PRECISION": 32,"SA": 0,"SB": 0,"STRM": 0,"STRN": 0,"VWM": 2,"VWN": 1}
    },
    {
      "kernel": "Xgemm",
      "time": 3.164,
      "parameters": {"GEMMK": 0,"KREG": 1,"KWG": 32,"KWI": 2,"MDIMA": 8,"MDIMC": 8,"MWG": 16,"NDIMB": 8,"NDIMC": 8,"NWG": 64,"PRECISION": 32,"SA": 1,"SB": 1,"STRM": 0,"STRN": 0,"VWM": 2,"VWN": 1}
    },
    {
      "kernel": "Xgemm",
      "time": 4.189,
      "parameters": {"GEMMK": 0,"KREG": 1,"KWG": 32,"KWI": 2,"MDIMA": 8,"MDIMC": 8,"MWG": 16,"NDIMB": 8,"NDIMC": 8,"NWG": 64,"PRECISION": 32,"SA": 0,"SB": 0,"STRM": 0,"STRN": 0,"VWM": 2,"VWN": 2}
    },
    {
      "kernel": "Xgemm",
      "time": 3.245,
      "parameters": {"GEMMK": 0,"KREG": 1,"KWG": 32,"KWI": 2,"MDIMA": 8,"MDIMC": 8,"MWG": 16,"NDIMB": 8,"NDIMC": 8,"NWG": 64,"PRECISION": 32,"SA": 1,"SB": 1,"STRM": 0,"STRN": 0,"VWM": 2,"VWN": 2}
    },
    {
      "kernel": "Xgemm",
      "time": 2.841,
      "parameters": {"GEMMK": 0,"KREG": 1,"KWG": 32,"KWI": 2,"MDIMA": 8,"MDIMC": 8,"MWG": 16,"NDIMB": 8,"NDIMC": 8,"NWG": 64,"PRECISION": 32,"SA": 0,"SB": 0,"STRM": 0,"STRN": 0,"VWM": 2,"VWN": 4}
    },
    {
      "kernel": "Xgemm",
      "time": 1.752,
      "parameters": {"GEMMK": 0,"KREG": 1,"KWG": 32,"KWI": 2,"MDIMA": 8,"MDIMC": 8,"MWG": 16,"NDIMB": 8,"NDIMC": 8,"NWG": 64,"PRECISION": 32,"SA": 1,"SB": 1,"STRM": 0,"STRN": 0,"VWM": 2,"VWN": 4}
    },
    {
      "kernel": "Xgemm",
      "time": 3.389,
      "parameters": {"GEMMK": 0,"KREG": 1,"KWG": 32,"KWI": 2,"MDIMA": 8,"MDIMC": 8,"MWG": 16,"NDIMB": 16,"NDIMC": 16,"NWG": 64,"PRECISION": 32,"SA": 0,"SB": 0,"STRM": 0,"STRN": 0,"VWM": 1,"VWN": 1}
    },
    {
      "kernel": "Xgemm",
      "time": 2.965,
      "parameters": {"GEMMK": 0,"KREG": 1,"KWG": 32,"KWI": 2,"MDIMA": 8,"MDIMC": 8,"MWG": 16,"NDIMB": 16,"NDIMC": 16,"NWG": 64,"PRECISION": 32,"SA": 1,"SB": 1,"STRM": 0,"STRN": 0,"VWM": 1,"VWN": 1}
    },
    {
      "kernel": "Xgemm",
      "time": 3.579,
      "parameters": {"GEMMK": 0,"KREG": 1,"KWG": 32,"KWI": 2,"MDIMA": 8,"MDIMC": 8,"MWG": 16,"NDIMB": 16,"NDIMC": 16,"NWG": 64,"PRECISION": 32,"SA": 0,"SB": 0,"STRM": 0,"STRN": 0,"VWM": 1,"VWN": 2}
    },
    {
      "kernel": "Xgemm",
      "time": 2.914,
      "parameters": {"GEMMK": 0,"KREG": 1,"KWG": 32,"KWI": 2,"MDIMA": 8,"MDIMC": 8,"MWG": 16,"NDIMB": 16,"NDIMC": 16,"NWG": 64,"PRECISION": 32,"SA": 1,"SB": 1,"STRM": 0,"STRN": 0,"VWM": 1,"VWN": 2}
    },
    {
      "kernel": "Xgemm",
      "time": 1.886,
      "parameters": {"GEMMK": 0,"KREG": 1,"KWG": 32,"KWI": 2,"MDIMA": 8,"MDIMC": 8,"MWG": 16,"NDIMB": 16,"NDIMC": 16,"NWG": 64,"PRECISION": 32,"SA": 0,"SB": 0,"STRM": 0,"STRN": 0,"VWM": 1,"VWN": 4}
    },
    {
      "kernel": "Xgemm",
      "time": 1.532,
      "parameters": {"GEMMK": 0,"KREG": 1,"KWG": 32,"KWI": 2,"MDIMA": 8,"MDIMC": 8,"MWG": 16,"NDIMB": 16,"NDIMC": 16,"NWG": 64,"PRECISION": 32,"SA": 1,"SB": 1,"STRM": 0,"STRN": 0,"VWM": 1,"VWN": 4}
    },
    {
      "kernel": "Xgemm",
      "time": 3.415,
      "parameters": {"GEMMK": 0,"KREG": 1,"KWG": 32,"KWI": 2,"MDIMA": 8,"MDIMC": 8,"MWG": 16,"NDIMB": 16,"NDIMC": 16,"NWG": 64,"PRECISION": 32,"SA": 0,"SB": 0,"STRM": 0,"STRN": 0,"VWM": 2,"VWN": 1}
    },
    {
      "kernel": "Xgemm",
      "time": 2.850,
      "parameters": {"GEMMK": 0,"KREG": 1,"KWG": 32,"KWI": 2,"MDIMA": 8,"MDIMC": 8,"MWG": 16,"NDIMB": 16,"NDIMC": 16,"NWG": 64,"PRECISION": 32,"SA": 1,"SB": 1,"STRM": 0,"STRN": 0,"VWM": 2,"VWN": 1}
    },
    {
      "kernel": "Xgemm",
      "time": 4.045,
      "parameters": {"GEMMK": 0,"KREG": 1,"KWG": 32,"KWI": 2,"MDIMA": 8,"MDIMC": 8,"MWG": 16,"NDIMB": 16,"NDIMC": 16,"NWG": 64,"PRECISION": 32,"SA": 0,"SB": 0,"STRM": 0,"STRN": 0,"VWM": 2,"VWN": 2}
    },
    {
      "kernel": "Xgemm",
      "time": 1.684,
      "parameters": {"GEMMK": 0,"KREG": 1,"KWG": 32,"KWI": 2,"MDIMA": 8,"MDIMC": 8,"MWG": 16,"NDIMB": 16,"NDIMC": 16,"NWG": 64,"PRECISION": 32,"SA": 1,"SB": 1,"STRM": 0,"STRN": 0,"VWM": 2,"VWN": 2}
    },
    {
      "kernel": "Xgemm",
      "time": 1.697,
      "parameters": {"GEMMK": 0,"KREG": 1,"KWG": 32,"KWI": 2,"MDIMA": 8,"MDIMC": 8,"MWG": 16,"NDIMB": 16,"NDIMC": 16,"NWG": 64,"PRECISION": 32,"SA": 0,"SB": 0,"STRM": 0,"STRN": 0,"VWM": 2,"VWN": 4}
    },
    {
      "kernel": "Xgemm",
      "time": 2.218,
      "parameters": {"GEMMK": 0,"KREG": 1,"KWG": 32,"KWI": 2,"MDIMA": 8,"MDIMC": 8,"MWG": 16,"NDIMB": 16,"NDIMC": 16,"NWG": 64,"PRECISION": 32,"SA": 1,"SB": 1,"STRM": 0,"STRN": 0,"VWM": 2,"VWN": 4}
    },
    {
      "kernel": "Xgemm",
      "time": 3.068,
      "parameters": {"GEMMK": 0,"KREG": 1,"KWG": 32,"KWI": 2,"MDIMA": 8,"MDIMC": 8,"MWG": 16,"NDIMB": 32,"NDIMC": 32,"NWG": 64,"PRECISION": 32,"SA": 0,"SB": 0,"STRM": 0,"STRN": 0,"VWM": 1,"VWN": 1}
    },
    {
      "kernel": "Xgemm",
      "time": 1.672,
      "parameters": {"GEMMK": 0,"KREG": 1,"KWG": 32,"KWI": 2,"MDIMA": 8,"MDIMC": 8,"MWG": 16,"NDIMB": 32,"NDIMC": 32,"NWG": 64,"PRECISION": 32,"SA": 1,"SB": 1,"STRM": 0,"STRN": 0,"VWM": 1,"VWN": 1}
    },
    {
      "kernel": "Xgemm",
      "time": 3.019,
      "parameters": {"GEMMK": 0,"KREG": 1,"KWG": 32,"KWI": 2,"MDIMA": 8,"MDIMC": 8,"MWG": 16,"NDIMB": 32,"NDIMC": 32,"NWG": 64,"PRECISION": 32,"SA": 0,"SB": 0,"STRM": 0,"STRN": 0,"VWM": 1,"VWN": 2}
    },
    {
      "kernel": "Xgemm",
      "time": 3.742,
      "parameters": {"GEMMK": 0,"KREG": 1,"KWG": 32,"KWI": 2,"MDIMA": 8,"MDIMC": 8,"MWG": 16,"NDIMB": 32,"NDIMC": 32,"NWG": 64,"PRECISION": 32,"SA": 1,"SB": 1,"STRM": 0,"STRN": 0,"VWM": 1,"VWN": 2}
    },
    {
      "kernel": "Xgemm",
      "time": 3.821,
      "parameters": {"GEMMK": 0,"KREG": 1,"KWG": 32,"KWI": 2,"MDIMA": 8,"MDIMC": 8,"MWG": 16,"NDIMB": 32,"NDIMC": 32,"NWG": 64,"PRECISION": 32,"SA": 0,"SB": 0,"STRM": 0,"STRN": 0,"VWM": 2,"VWN": 1}
    },
    {
      "kernel": "Xgemm",
      "time": 1.940,
      "parameters": {"GEMMK": 0,"KREG": 1,"KWG": 32,"KWI": 2,"MDIMA": 8,"MDIMC": 8,"MWG": 16,"NDIMB": 32,"NDIMC": 32,"NWG": 64,"PRECISION": 32,"SA": 1,"SB": 1,"STRM": 0,"STRN": 0,"VWM": 2,"VWN": 1}
    },
    {
      "kernel": "Xgemm",
      "time": 1.666,
      "parameters": {"GEMMK": 0,"KREG": 1,"KWG": 32,"KWI": 2,"MDIMA": 8,"MDIMC": 8,"MWG": 16,"NDIMB": 32,"NDIMC": 32,"NWG": 64,"PRECISION": 32,"SA": 0,"SB": 0,"STRM": 0,"STRN": 0,"VWM": 2,"VWN": 2}
    },
    {
      "kernel": "Xgemm",
      "time": 1.943,
      "parameters": {"GEMMK": 0,"KREG": 1,"KWG": 32,"KWI": 2,"MDIMA": 8,"MDIMC": 8,"MWG": 16,"NDIMB": 32,"NDIMC": 32,"NWG": 64,"PRECISION": 32,"SA": 1,"SB": 1,"STRM": 0,"STRN": 0,"VWM": 2,"VWN": 2}
    },
    {
      "kernel": "Xgemm",
      "time": 2.235,
      "parameters": {"GEMMK": 0,"KREG": 1,"KWG": 32,"KWI": 2,"MDIMA": 16,"MDIMC": 16,"MWG": 16,"NDIMB": 8,"NDIMC": 8,"NWG": 64,"PRECISION": 32,"SA": 0,"SB": 0,"STRM": 0,"STRN": 0,"VWM": 1,"VWN": 1}
    },
    {
      "kernel": "Xgemm",
      "time": 1.858,
      "parameters": {"GEMMK": 0,"KREG": 1,"KWG": 32,"KWI": 2,"MDIMA": 16,"MDIMC": 16,"MWG": 16,"NDIMB": 8,"NDIMC": 8,"NWG": 64,"PRECISION": 32,"SA": 1,"SB": 1,"STRM": 0,"STRN": 0,"VWM": 1,"VWN": 1}
    },
    {
      "kernel": "Xgemm",
      "time": 2.909,
      "parameters": {"GEMMK": 0,"KREG": 1,"KWG": 32,"KWI": 2,"MDIMA": 16,"MDIMC": 16,"MWG": 16,"NDIMB": 8,"NDIMC": 8,"NWG": 64,"PRECISION": 32,"SA": 0,"SB": 0,"STRM": 0,"STRN": 0,"VWM": 1,"VWN": 2}
    },
    {
      "kernel": "Xgemm",
      "time": 1.820,
      "parameters": {"GEMMK": 0,"KREG": 1,"KWG": 32,"KWI": 2,"MDIMA": 16,"MDIMC": 16,"MWG": 16,"NDIMB": 8,"NDIMC": 8,"NWG": 64,"PRECISION": 32,"SA": 1,"SB": 1,"STRM": 0,"STRN": 0,"VWM": 1,"VWN": 2}
    },
    {
      "kernel": "Xgemm",
      "time": 1.729,
      "parameters": {"GEMMK": 0,"KREG": 1,"KWG": 32,"KWI": 2,"MDIMA": 16,"MDIMC": 16,"MWG": 16,"NDIMB": 8,"NDIMC": 8,"NWG": 64,"PRECISION": 32,"SA": 0,"SB": 0,"STRM": 0,"STRN": 0,"VWM": 1,"VWN": 4}
    },
    {
      "kernel": "Xgemm",
      "time": 2.721,
      "parameters": {"GEMMK": 0,"KREG": 1,"KWG": 32,"KWI": 2,"MDIMA": 16,"MDIMC": 16,"MWG": 16,"NDIMB": 8,"NDIMC": 8,"NWG": 64,"PRECISION": 32,"SA": 1,"SB": 1,"STRM": 0,"STRN": 0,"VWM": 1,"VWN": 4}
    },
    {
      "kernel": "Xgemm",
      "time": 4.433,
      "parameters": {"GEMMK": 0,"KREG": 1,"KWG": 32,"KWI": 2,"MDIMA": 16,"MDIMC": 16,"MWG": 16,"NDIMB": 16,"NDIMC": 16,"NWG": 64,"PRECISION": 32,"SA": 0,"SB": 0,"STRM": 0,"STRN": 0,"VWM": 1,"VWN": 1}
    },
    {
      "kernel": "Xgemm",
      "time": 2.930,
      "parameters": {"GEMMK": 0,"KREG": 1,"KWG": 32,"KWI": 2,"MDIMA": 16,"MDIMC": 16,"MWG": 16,"NDIMB": 16,"NDIMC": 16,"NWG": 64,"PRECISION": 32,"SA": 1,"SB": 1,"STRM": 0,"STRN": 0,"VWM": 1,"VWN": 1}
    },
    {
      "kernel": "Xgemm",
      "time": 2.002,
      "parameters": {"GEMMK": 0,"KREG": 1,"KWG": 32,"KWI": 2,"MDIMA": 16,"MDIMC": 16,"MWG": 16,"NDIMB": 16,"NDIMC": 16,"NWG": 64,"PRECISION": 32,"SA": 0,"SB": 0,"STRM": 0,"STRN": 0,"VWM": 1,"VWN": 2}
    },
    {
      "kernel": "Xgemm",
      "time": 2.883,
      "parameters": {"GEMMK": 0,"KREG": 1,"KWG": 32,"KWI": 2,"MDIMA": 16,"MDIMC": 16,"MWG": 16,"NDIMB": 16,"NDIMC": 16,"NWG": 64,"PRECISION": 32,"SA": 1,"SB": 1,"STRM": 0,"STRN": 0,"VWM": 1,"VWN": 2}
    },
    {
      "kernel": "Xgemm",
      "time": 3.289,
      "parameters": {"GEMMK": 0,"KREG": 1,"KWG": 32,"KWI": 2,"MDIMA": 16,"MDIMC": 16,"MWG": 16,"NDIMB": 16,"NDIMC": 16,"NWG": 64,"PRECISION": 32,"SA": 0,"SB": 0,"STRM": 0,"STRN": 0,"VWM": 1,"VWN": 4}
    },
    {
      "kernel": "Xgemm",
      "time": 3.164,
      "parameters": {"GEMMK": 0,"KREG": 1,"KWG": 32,"KWI": 2,"MDIMA": 16,"MDIMC": 16,"MWG": 16,"NDIMB": 16,"NDIMC": 16,"NWG": 64,"PRECISION": 32,"SA": 1,"SB": 1,"STRM": 0,"STRN": 0,"VWM": 1,"VWN": 4}
    },
    {
      "kernel": "Xgemm",
      "time": 3.868,
      "parameters": {"GEMMK": 0,"KREG": 1,"KWG": 32,"KWI": 2,"MDIMA": 8,"MDIMC": 8,"MWG": 32,"NDIMB": 8,"NDIMC": 8,"NWG": 16,"PRECISION": 32,"SA": 0,"SB": 0,"STRM": 0,"STRN": 0,"VWM": 1,"VWN": 1}
    },
    {
      "kernel": "Xgemm",
      "time": 3.116,
      "parameters": {"GEMMK": 0,"KREG": 1,"KWG": 32,"KWI": 2,"MDIMA": 8,"MDIMC": 8,"MWG": 32,"NDIMB": 8,"NDIMC": 8,"NWG": 16,"PRECISION": 32,"SA": 1,"SB": 1,"STRM": 0,"STRN": 0,"VWM": 1,"VWN": 1}
    },
    {
      "kernel": "Xgemm",
      "time": 5.515,
      "parameters": {"GEMMK": 0,"KREG": 1,"KWG": 32,"KWI": 2,"MDIMA": 8,"MDIMC": 8,"MWG": 32,"NDIMB": 8,"NDIMC": 8,"NWG": 16,"PRECISION": 32,"SA": 0,"SB": 0,"STRM": 0,"STRN": 0,"VWM": 1,"VWN": 2}
    },
    {
      "kernel": "Xgemm",
      "time": 2.904,
      "parameters": {"GEMMK": 0,"KREG": 1,"KWG": 32,"KWI": 2,"MDIMA": 8,"MDIMC": 8,"MWG": 32,"NDIMB": 8,"NDIMC": 8,"NWG": 16,"PRECISION": 32,"SA": 1,"SB": 1,"STRM": 0,"STRN": 0,"VWM": 1,"VWN": 2}
    },
    {
      "kernel": "Xgemm",
      "time": 3.740,
      "parameters": {"GEMMK": 0,"KREG": 1,"KWG": 32,"KWI": 2,"MDIMA": 8,"MDIMC": 8,"MWG": 32,"NDIMB": 8,"NDIMC": 8,"NWG": 16,"PRECISION": 32,"SA": 0,"SB": 0,"STRM": 0,"STRN": 0,"VWM": 2,"VWN": 1}
    },
    {
      "kernel": "Xgemm",
      "time": 2.789,
      "parameters": {"GEMMK": 0,"KREG": 1,"KWG": 32,"KWI": 2,"MDIMA": 8,"MDIMC": 8,"MWG": 32,"NDIMB": 8,"NDIMC": 8,"NWG": 16,"PRECISION": 32,"SA": 1,"SB": 1,"STRM": 0,"STRN": 0,"VWM": 2,"VWN": 1}
    },
    {
      "kernel": "Xgemm",
      "time": 5.176,
      "parameters": {"GEMMK": 0,"KREG": 1,"KWG": 32,"KWI": 2,"MDIMA": 8,"MDIMC": 8,"MWG": 32,"NDIMB": 8,"NDIMC": 8,"NWG": 16,"PRECISION": 32,"SA": 0,"SB": 0,"STRM": 0,"STRN": 0,"VWM": 2,"VWN": 2}
    },
    {
      "kernel": "Xgemm",
      "time": 2.859,
      "parameters": {"GEMMK": 0,"KREG": 1,"KWG": 32,"KWI": 2,"MDIMA": 8,"MDIMC": 8,"MWG": 32,"NDIMB": 8,"NDIMC": 8,"NWG": 16,"PRECISION": 32,"SA": 1,"SB": 1,"STRM": 0,"STRN": 0,"VWM": 2,"VWN": 2}
    },
    {
      "kernel": "Xgemm",
      "time": 2.161,
      "parameters": {"GEMMK": 0,"KREG": 1,"KWG": 32,"KWI": 2,"MDIMA": 8,"MDIMC": 8,"MWG": 32,"NDIMB": 8,"NDIMC": 8,"NWG": 16,"PRECISION": 32,"SA": 0,"SB": 0,"STRM": 0,"STRN": 0,"VWM": 4,"VWN": 1}
    },
    {
      "kernel": "Xgemm",
      "time": 1.598,
      "parameters": {"GEMMK": 0,"KREG": 1,"KWG": 32,"KWI": 2,"MDIMA": 8,"MDIMC": 8,"MWG": 32,"NDIMB": 8,"NDIMC": 8,"NWG": 16,"PRECISION": 32,"SA": 1,"SB": 1,"STRM": 0,"STRN": 0,"VWM": 4,"VWN": 1}
    },
    {
      "kernel": "Xgemm",
      "time": 2.795,
      "parameters": {"GEMMK": 0,"KREG": 1,"KWG": 32,"KWI": 2,"MDIMA": 8,"MDIMC": 8,"MWG": 32,"NDIMB": 8,"NDIMC": 8,"NWG": 16,"PRECISION": 32,"SA": 0,"SB": 0,"STRM": 0,"STRN": 0,"VWM": 4,"VWN": 2}
    },
    {
      "kernel": "Xgemm",
      "time": 2.643,
      "parameters": {"GEMMK": 0,"KREG": 1,"KWG": 32,"KWI": 2,"MDIMA": 8,"MDIMC": 8,"MWG": 32,"NDIMB": 8,"NDIMC": 8,"NWG": 16,"PRECISION": 32,"SA": 1,"SB": 1,"STRM": 0,"STRN": 0,"VWM": 4,"VWN": 2}
    },
    {
      "kernel": "Xgemm",
      "time": 4.237,
      "parameters": {"GEMMK": 0,"KREG": 1,"KWG": 32,"KWI": 2,"MDIMA": 8,"MDIMC": 8,"MWG": 32,"NDIMB": 16,"NDIMC": 16,"NWG": 16,"PRECISION": 32,"SA": 0,"SB": 0,"STRM": 0,"STRN": 0,"VWM": 1,"VWN": 1}
    },
    {
      "kernel": "Xgemm",
      "time": 3.760,
      "parameters": {"GEMMK": 0,"KREG": 1,"KWG": 32,"KWI": 2,"MDIMA": 8,"MDIMC": 8,"MWG": 32,"NDIMB": 16,"NDIMC": 16,"NWG": 16,"PRECISION": 32,"SA": 1,"SB": 1,"STRM": 0,"STRN": 0,"VWM": 1,"VWN": 1}
    },
    {
      "kernel": "Xgemm",
      "time": 3.865,
      "parameters": {"GEMMK": 0,"KREG": 1,"KWG": 32,"KWI": 2,"MDIMA": 8,"MDIMC": 8,"MWG": 32,"NDIMB": 16,"NDIMC": 16,"NWG": 16,"PRECISION": 32,"SA": 0,"SB": 0,"STRM": 0,"STRN": 0,"VWM": 2,"VWN": 1}
    },
    {
      "kernel": "Xgemm",
      "time": 3.240,
      "parameters": {"GEMMK": 0,"KREG": 1,"KWG": 32,"KWI": 2,"MDIMA": 8,"MDIMC": 8,"MWG": 32,"NDIMB": 16,"NDIMC": 16,"NWG": 16,"PRECISION": 32,"SA": 1,"SB": 1,"STRM": 0,"STRN": 0,"VWM": 2,"VWN": 1}
    },
    {
      "kernel": "Xgemm",
      "time": 3.626,
      "parameters": {"GEMMK": 0,"KREG": 1,"KWG": 32,"KWI": 2,"MDIMA": 8,"MDIMC": 8,"MWG": 32,"NDIMB": 16,"NDIMC": 16,"NWG": 16,"PRECISION": 32,"SA": 0,"SB": 0,"STRM": 0,"STRN": 0,"VWM": 4,"VWN": 1}
    },
    {
      "kernel": "Xgemm",
      "time": 1.804,
      "parameters": {"GEMMK": 0,"KREG": 1,"KWG": 32,"KWI": 2,"MDIMA": 8,"MDIMC": 8,"MWG": 32,"NDIMB": 16,"NDIMC": 16,"NWG": 16,"PRECISION": 32,"SA": 1,"SB": 1,"STRM": 0,"STRN": 0,"VWM": 4,"VWN": 1}
    },
    {
      "kernel": "Xgemm",
      "time": 1.809,
      "parameters": {"GEMMK": 0,"KREG": 1,"KWG": 32,"KWI": 2,"MDIMA": 16,"MDIMC": 16,"MWG": 32,"NDIMB": 8,"NDIMC": 8,"NWG": 16,"PRECISION": 32,"SA": 0,"SB": 0,"STRM": 0,"STRN": 0,"VWM": 1,"VWN": 1}
    },
    {
      "kernel": "Xgemm",
      "time": 2.490,
      "parameters": {"GEMMK": 0,"KREG": 1,"KWG": 32,"KWI": 2,"MDIMA": 16,"MDIMC": 16,"MWG": 32,"NDIMB": 8,"NDIMC": 8,"NWG": 16,"PRECISION": 32,"SA": 1,"SB": 1,"STRM": 0,"STRN": 0,"VWM": 1,"VWN": 1}
    },
    {
      "kernel": "Xgemm",
      "time": 3.850,
      "parameters": {"GEMMK": 0,"KREG": 1,"KWG": 32,"KWI": 2,"MDIMA": 16,"MDIMC": 16,"MWG": 32,"NDIMB": 8,"NDIMC": 8,"NWG": 16,"PRECISION": 32,"SA": 0,"SB": 0,"STRM": 0,"STRN": 0,"VWM": 1,"VWN": 2}
    },
    {
      "kernel": "Xgemm",
      "time": 2.693,
      "parameters": {"GEMMK": 0,"KREG": 1,"KWG": 32,"KWI": 2,"MDIMA": 16,"MDIMC": 16,"MWG": 32,"NDIMB": 8,"NDIMC": 8,"NWG": 16,"PRECISION": 32,"SA": 1,"SB": 1,"STRM": 0,"STRN": 0,"VWM": 1,"VWN": 2}
    },
    {
      "kernel": "Xgemm",
      "time": 2.040,
      "parameters": {"GEMMK": 0,"KREG": 1,"KWG": 32,"KWI": 2,"MDIMA": 16,"MDIMC": 16,"MWG": 32,"NDIMB": 8,"NDIMC": 8,"NWG": 16,"PRECISION": 32,"SA": 0,"SB": 0,"STRM": 0,"STRN": 0,"VWM": 2,"VWN": 1}
    },
    {
      "kernel": "Xgemm",
      "time": 3.031,
      "parameters": {"GEMMK": 0,"KREG": 1,"KWG": 32,"KWI": 2,"MDIMA": 16,"MDIMC": 16,"MWG": 32,"NDIMB": 8,"NDIMC": 8,"NWG": 16,"PRECISION": 32,"SA": 1,"SB": 1,"STRM": 0,"STRN": 0,"VWM": 2,"VWN": 1}
    },
    {
      "kernel": "Xgemm",
      "time": 3.658,
      "parameters": {"GEMMK": 0,"KREG": 1,"KWG": 32,"KWI": 2,"MDIMA": 16,"MDIMC": 16,"MWG": 32,"NDIMB": 8,"NDIMC": 8,"NWG": 16,"PRECISION": 32,"SA": 0,"SB": 0,"STRM": 0,"STRN": 0,"VWM": 2,"VWN": 2}
    },
    {
      "kernel": "Xgemm",
      "time": 1.567,
      "parameters": {"GEMMK": 0,"KREG": 1,"KWG": 32,"KWI": 2,"MDIMA": 16,"MDIMC": 16,"MWG": 32,"NDIMB": 8,"NDIMC": 8,"NWG": 16,"PRECISION": 32,"SA": 1,"SB": 1,"STRM": 0,"STRN": 0,"VWM": 2,"VWN": 2}
    },
    {
      "kernel": "Xgemm",
      "time": 5.259,
      "parameters": {"GEMMK": 0,"KREG": 1,"KWG": 32,"KWI": 2,"MDIMA": 16,"MDIMC": 16,"MWG": 32,"NDIMB": 16,"NDIMC": 16,"NWG": 16,"PRECISION": 32,"SA": 0,"SB": 0,"STRM": 0,"STRN": 0,"VWM": 1,"VWN": 1}
    },
    {
      "kernel": "Xgemm",
      "time": 4.321,
      "parameters": {"GEMMK": 0,"KREG": 1,"KWG": 32,"KWI": 2,"MDIMA": 16,"MDIMC": 16,"MWG": 32,"NDIMB": 16,"NDIMC": 16,"NWG": 16,"PRECISION": 32,"SA": 1,"SB": 1,"STRM": 0,"STRN": 0,"VWM": 1,"VWN": 1}
    },
    {
      "kernel": "Xgemm",
      "time": 6.878,
      "parameters": {"GEMMK": 0,"KREG": 1,"KWG": 32,"KWI": 2,"MDIMA": 16,"MDIMC": 16,"MWG": 32,"NDIMB": 16,"NDIMC": 16,"NWG": 16,"PRECISION": 32,"SA": 0,"SB": 0,"STRM": 0,"STRN": 0,"VWM": 2,"VWN": 1}
    },
    {
      "kernel": "Xgemm",
      "time": 1.982,
      "parameters": {"GEMMK": 0,"KREG": 1,"KWG": 32,"KWI": 2,"MDIMA": 16,"MDIMC": 16,"MWG": 32,"NDIMB": 16,"NDIMC": 16,"NWG": 16,"PRECISION": 32,"SA": 1,"SB": 1,"STRM": 0,"STRN": 0,"VWM": 2,"VWN": 1}
    },
    {
      "kernel": "Xgemm",
      "time": 4.111,
      "parameters": {"GEMMK": 0,"KREG": 1,"KWG": 32,"KWI": 2,"MDIMA": 32,"MDIMC": 32,"MWG": 32,"NDIMB": 8,"NDIMC": 8,"NWG": 16,"PRECISION": 32,"SA": 0,"SB": 0,"STRM": 0,"STRN": 0,"VWM": 1,"VWN": 1}
    },
    {
      "kernel": "Xgemm",
      "time": 5.397,
      "parameters": {"GEMMK": 0,"KREG": 1,"KWG": 32,"KWI": 2,"MDIMA": 32,"MDIMC": 32,"MWG": 32,"NDIMB": 8,"NDIMC": 8,"NWG": 16,"PRECISION": 32,"SA": 1,"SB": 1,"STRM": 0,"STRN": 0,"VWM": 1,"VWN": 1}
    },
    {
      "kernel": "Xgemm",
      "time": 3.440,
      "parameters": {"GEMMK": 0,"KREG": 1,"KWG": 32,"KWI": 2,"MDIMA": 32,"MDIMC": 32,"MWG": 32,"NDIMB": 8,"NDIMC": 8,"NWG": 16,"PRECISION": 32,"SA": 0,"SB": 0,"STRM": 0,"STRN": 0,"VWM": 1,"VWN": 2}
    },
    {
      "kernel": "Xgemm",
      "time": 2.643,
      "parameters": {"GEMMK": 0,"KREG": 1,"KWG": 32,"KWI": 2,"MDIMA": 32,"MDIMC": 32,"MWG": 32,"NDIMB": 8,"NDIMC": 8,"NWG": 16,"PRECISION": 32,"SA": 1,"SB": 1,"STRM": 0,"STRN": 0,"VWM": 1,"VWN": 2}
    },
    {
      "kernel": "Xgemm",
      "time": 2.132,
      "parameters": {"GEMMK": 0,"KREG": 1,"KWG": 32,"KWI": 2,"MDIMA": 8,"MDIMC": 8,"MWG": 32,"NDIMB": 8,"NDIMC": 8,"NWG": 32,"PRECISION": 32,"SA": 0,"SB": 0,"STRM": 0,"STRN": 0,"VWM": 1,"VWN": 1}
    },
    {
      "kernel": "Xgemm",
      "time": 2.705,
      "parameters": {"GEMMK": 0,"KREG": 1,"KWG": 32,"KWI": 2,"MDIMA": 8,"MDIMC": 8,"MWG": 32,"NDIMB": 8,"NDIMC": 8,"NWG": 32,"PRECISION": 32,"SA": 1,"SB": 1,"STRM": 0,"STRN": 0,"VWM": 1,"VWN": 1}
    },
    {
      "kernel": "Xgemm",
      "time": 2.189,
      "parameters": {"GEMMK": 0,"KREG": 1,"KWG": 32,"KWI": 2,"MDIMA": 8,"MDIMC": 8,"MWG": 32,"NDIMB": 8,"NDIMC": 8,"NWG": 32,"PRECISION": 32,"SA": 0,"SB": 0,"STRM": 0,"STRN": 0,"VWM": 1,"VWN": 2}
    },
    {
      "kernel": "Xgemm",
      "time": 1.778,
      "parameters": {"GEMMK": 0,"KREG": 1,"KWG": 32,"KWI": 2,"MDIMA": 8,"MDIMC": 8,"MWG": 32,"NDIMB": 8,"NDIMC": 8,"NWG": 32,"PRECISION": 32,"SA": 1,"SB": 1,"STRM": 0,"STRN": 0,"VWM": 1,"VWN": 2}
    },
    {
      "kernel": "Xgemm",
      "time": 3.952,
      "parameters": {"GEMMK": 0,"KREG": 1,"KWG": 32,"KWI": 2,"MDIMA": 8,"MDIMC": 8,"MWG": 32,"NDIMB": 8,"NDIMC": 8,"NWG": 32,"PRECISION": 32,"SA": 0,"SB": 0,"STRM": 0,"STRN": 0,"VWM": 1,"VWN": 4}
    },
    {
      "kernel": "Xgemm",
      "time": 2.706,
      "parameters": {"GEMMK": 0,"KREG": 1,"KWG": 32,"KWI": 2,"MDIMA": 8,"MDIMC": 8,"MWG": 32,"NDIMB": 8,"NDIMC": 8,"NWG": 32,"PRECISION": 32,"SA": 1,"SB": 1,"STRM": 0,"STRN": 0,"VWM": 1,"VWN": 4}
    },
    {
      "kernel": "Xgemm",
      "time": 4.258,
      "parameters": {"GEMMK": 0,"KREG": 1,"KWG": 32,"KWI": 2,"MDIMA": 8,"MDIMC": 8,"MWG": 32,"NDIMB": 8,"NDIMC": 8,"NWG": 32,"PRECISION": 32,"SA": 0,"SB": 0,"STRM": 0,"STRN": 0,"VWM": 2,"VWN": 1}
    },
    {
      "kernel": "Xgemm",
      "time": 2.702,
      "parameters": {"GEMMK": 0,"KREG": 1,"KWG": 32,"KWI": 2,"MDIMA": 8,"MDIMC": 8,"MWG": 32,"NDIMB": 8,"NDIMC": 8,"NWG": 32,"PRECISION": 32,"SA": 1,"SB": 1,"STRM": 0,"STRN": 0,"VWM": 2,"VWN": 1}
    },
    {
      "kernel": "Xgemm",
      "time": 3.867,
      "parameters": {"GEMMK": 0,"KREG": 1,"KWG": 32,"KWI": 2,"MDIMA": 8,"MDIMC": 8,"MWG": 32,"NDIMB": 8,"NDIMC": 8,"NWG": 32,"PRECISION": 32,"SA": 0,"SB": 0,"STRM": 0,"STRN": 0,"VWM": 2,"VWN": 2}
    },
    {
      "kernel": "Xgemm",
      "time": 2.672,
      "parameters": {"GEMMK": 0,"KREG": 1,"KWG": 32,"KWI": 2,"MDIMA": 8,"MDIMC": 8,"MWG": 32,"NDIMB": 8,"NDIMC": 8,"NWG": 32,"PRECISION": 32,"SA": 1,"SB": 1,"STRM": 0,"STRN": 0,"VWM": 2,"VWN": 2}
    },
    {
      "kernel": "Xgemm",
      "time": 4.132,
      "parameters": {"GEMMK": 0,"KREG": 1,"KWG": 32,"KWI": 2,"MDIMA": 8,"MDIMC": 8,"MWG": 32,"NDIMB": 8,"NDIMC": 8,"NWG": 32,"PRECISION": 32,"SA": 0,"SB": 0,"STRM": 0,"STRN": 0,"VWM": 2,"VWN": 4}
    },
    {
      "kernel": "Xgemm",
      "time": 2.765,
      "parameters": {"GEMMK": 0,"KREG": 1,"KWG": 32,"KWI": 2,"MDIMA": 8,"MDIMC": 8,"MWG": 32,"NDIMB": 8,"NDIMC": 8,"NWG": 32,"PRECISION": 32,"SA": 1,"SB": 1,"STRM": 0,"STRN": 0,"VWM": 2,"VWN": 4}
    },
    {
      "kernel": "Xgemm",
      "time": 3.743,
      "parameters": {"GEMMK": 0,"KREG": 1,"KWG": 32,"KWI": 2,"MDIMA": 8,"MDIMC": 8,"MWG": 32,"NDIMB": 8,"NDIMC": 8,"NWG": 32,"PRECISION": 32,"SA": 0,"SB": 0,"STRM": 0,"STRN": 0,"VWM": 4,"VWN": 1}
    },
    {
      "kernel": "Xgemm",
      "time": 1.426,
      "parameters": {"GEMMK": 0,"KREG": 1,"KWG": 32,"KWI": 2,"MDIMA": 8,"MDIMC": 8,"MWG": 32,"NDIMB": 8,"NDIMC": 8,"NWG": 32,"PRECISION": 32,"SA": 1,"SB": 1,"STRM": 0,"STRN": 0,"VWM": 4,"VWN": 1}
    },
    {
      "kernel": "Xgemm",
      "time": 4.362,
      "parameters": {"GEMMK": 0,"KREG": 1,"KWG": 32,"KWI": 2,"MDIMA": 8,"MDIMC": 8,"MWG": 32,"NDIMB": 8,"NDIMC": 8,"NWG": 32,"PRECISION": 32,"SA": 0,"SB": 0,"STRM": 0,"STRN": 0,"VWM": 4,"VWN": 2}
    },
    {
      "kernel": "Xgemm",
      "time": 2.713,
      "parameters": {"GEMMK": 0,"KREG": 1,"KWG": 32,"KWI": 2,"MDIMA": 8,"MDIMC": 8,"MWG": 32,"NDIMB": 8,"NDIMC": 8,"NWG": 32,"PRECISION": 32,"SA": 1,"SB": 1,"STRM": 0,"STRN": 0,"VWM": 4,"VWN": 2}
    },
    {
      "kernel": "Xgemm",
      "time": 2.288,
      "parameters": {"GEMMK": 0,"KREG": 1,"KWG": 32,"KWI": 2,"MDIMA": 8,"MDIMC": 8,"MWG": 32,"NDIMB": 8,"NDIMC": 8,"NWG": 32,"PRECISION": 32,"SA": 0,"SB": 0,"STRM": 0,"STRN": 0,"VWM": 4,"VWN": 4}
    },
    {
      "kernel": "Xgemm",
      "time": 2.125,
      "parameters": {"GEMMK": 0,"KREG": 1,"KWG": 32,"KWI": 2,"MDIMA": 8,"MDIMC": 8,"MWG": 32,"NDIMB": 8,"NDIMC": 8,"NWG": 32,"PRECISION": 32,"SA": 1,"SB": 1,"STRM": 0,"STRN": 0,"VWM": 4,"VWN": 4}
    },
    {
      "kernel": "Xgemm",
      "time": 3.810,
      "parameters": {"GEMMK": 0,"KREG": 1,"KWG": 32,"KWI": 2,"MDIMA": 8,"MDIMC": 8,"MWG": 32,"NDIMB": 16,"NDIMC": 16,"NWG": 32,"PRECISION": 32,"SA": 0,"SB": 0,"STRM": 0,"STRN": 0,"VWM": 1,"VWN": 1}
    },
    {
      "kernel": "Xgemm",
      "time": 1.330,
      "parameters": {"GEMMK": 0,"KREG": 1,"KWG": 32,"KWI": 2,"MDIMA": 8,"MDIMC": 8,"MWG": 32,"NDIMB": 16,"NDIMC": 16,"NWG": 32,"PRECISION": 32,"SA": 1,"SB": 1,"STRM": 0,"STRN": 0,"VWM": 1,"VWN": 1}
    },
    {
      "kernel": "Xgemm",
      "time": 2.270,
      "parameters": {"GEMMK": 0,"KREG": 1,"KWG": 32,"KWI": 2,"MDIMA": 8,"MDIMC": 8,"MWG": 32,"NDIMB": 16,"NDIMC": 16,"NWG": 32,"PRECISION": 32,"SA": 0,"SB": 0,"STRM": 0,"STRN": 0,"VWM": 1,"VWN": 2}
    },
    {
      "kernel": "Xgemm",
      "time": 2.215,
      "parameters": {"GEMMK": 0,"KREG": 1,"KWG": 32,"KWI": 2,"MDIMA": 8,"MDIMC": 8,"MWG": 32,"NDIMB": 16,"NDIMC": 16,"NWG": 32,"PRECISION": 32,"SA": 1,"SB": 1,"STRM": 0,"STRN": 0,"VWM": 1,"VWN": 2}
    },
    {
      "kernel": "Xgemm",
      "time": 3.530,
      "parameters": {"GEMMK": 0,"KREG": 1,"KWG": 32,"KWI": 2,"MDIMA": 8,"MDIMC": 8,"MWG": 32,"NDIMB": 16,"NDIMC": 16,"NWG": 32,"PRECISION": 32,"SA": 0,"SB": 0,"STRM": 0,"STRN": 0,"VWM": 2,"VWN": 1}
    },
    {
      "kernel": "Xgemm",
      "time": 2.589,
      "parameters": {"GEMMK": 0,"KREG": 1,"KWG": 32,"KWI": 2,"MDIMA": 8,"MDIMC": 8,"MWG": 32,"NDIMB": 16,"NDIMC": 16,"NWG": 32,"PRECISION": 32,"SA": 1,"SB": 1,"STRM": 0,"STRN": 0,"VWM": 2,"VWN": 1}
    },
    {
      "kernel": "Xgemm",
      "time": 5.026,
      "parameters": {"GEMMK": 0,"KREG": 1,"KWG": 32,"KWI": 2,"MDIMA": 8,"MDIMC": 8,"MWG": 32,"NDIMB": 16,"NDIMC": 16,"NWG": 32,"PRECISION": 32,"SA": 0,"SB": 0,"STRM": 0,"STRN": 0,"VWM": 2,"VWN": 2}
    },
    {
      "kernel": "Xgemm",
      "time": 2.351,
      "parameters": {"GEMMK": 0,"KREG": 1,"KWG": 32,"KWI": 2,"MDIMA": 8,"MDIMC": 8,"MWG": 32,"NDIMB": 16,"NDIMC": 16,"NWG": 32,"PRECISION": 32,"SA": 1,"SB": 1,"STRM": 0,"STRN": 0,"VWM": 2,"VWN": 2}
    },
    {
      "kernel": "Xgemm",
      "time": 3.804,
      "parameters": {"GEMMK": 0,"KREG": 1,"KWG": 32,"KWI": 2,"MDIMA": 8,"MDIMC": 8,"MWG": 32,"NDIMB": 16,"NDIMC": 16,"NWG": 32,"PRECISION": 32,"SA": 0,"SB": 0,"STRM": 0,"STRN": 0,"VWM": 4,"VWN": 1}
    },
    {
      "kernel": "Xgemm",
      "time": 2.774,
      "parameters": {"GEMMK": 0,"KREG": 1,"KWG": 32,"KWI": 2,"MDIMA": 8,"MDIMC": 8,"MWG": 32,"NDIMB": 16,"NDIMC": 16,"NWG": 32,"PRECISION": 32,"SA": 1,"SB": 1,"STRM": 0,"STRN": 0,"VWM": 4,"VWN": 1}
    },
    {
      "kernel": "Xgemm",
      "time": 3.449,
      "parameters": {"GEMMK": 0,"KREG": 1,"KWG": 32,"KWI": 2,"MDIMA": 8,"MDIMC": 8,"MWG": 32,"NDIMB": 16,"NDIMC": 16,"NWG": 32,"PRECISION": 32,"SA": 0,"SB": 0,"STRM": 0,"STRN": 0,"VWM": 4,"VWN": 2}
    },
    {
      "kernel": "Xgemm",
      "time": 2.589,
      "parameters": {"GEMMK": 0,"KREG": 1,"KWG": 32,"KWI": 2,"MDIMA": 8,"MDIMC": 8,"MWG": 32,"NDIMB": 16,"NDIMC": 16,"NWG": 32,"PRECISION": 32,"SA": 1,"SB": 1,"STRM": 0,"STRN": 0,"VWM": 4,"VWN": 2}
    },
    {
      "kernel": "Xgemm",
      "time": 4.263,
      "parameters": {"GEMMK": 0,"KREG": 1,"KWG": 32,"KWI": 2,"MDIMA": 8,"MDIMC": 8,"MWG": 32,"NDIMB": 32,"NDIMC": 32,"NWG": 32,"PRECISION": 32,"SA": 0,"SB": 0,"STRM": 0,"STRN": 0,"VWM": 1,"VWN": 1}
    },
    {
      "kernel": "Xgemm",
      "time": 3.305,
      "parameters": {"GEMMK": 0,"KREG": 1,"KWG": 32,"KWI": 2,"MDIMA": 8,"MDIMC": 8,"MWG": 32,"NDIMB": 32,"NDIMC": 32,"NWG": 32,"PRECISION": 32,"SA": 1,"SB": 1,"STRM": 0,"STRN": 0,"VWM": 1,"VWN": 1}
    },
    {
      "kernel": "Xgemm",
      "time": 3.819,
      "parameters": {"GEMMK": 0,"KREG": 1,"KWG": 32,"KWI": 2,"MDIMA": 8,"MDIMC": 8,"MWG": 32,"NDIMB": 32,"NDIMC": 32,"NWG": 32,"PRECISION": 32,"SA": 0,"SB": 0,"STRM": 0,"STRN": 0,"VWM": 2,"VWN": 1}
    },
    {
      "kernel": "Xgemm",
      "time": 2.038,
      "parameters": {"GEMMK": 0,"KREG": 1,"KWG": 32,"KWI": 2,"MDIMA": 8,"MDIMC": 8,"MWG": 32,"NDIMB": 32,"NDIMC": 32,"NWG": 32,"PRECISION": 32,"SA": 1,"SB": 1,"STRM": 0,"STRN": 0,"VWM": 2,"VWN": 1}
    },
    {
      "kernel": "Xgemm",
      "time": 1.971,
      "parameters": {"GEMMK": 0,"KREG": 1,"KWG": 32,"KWI": 2,"MDIMA": 8,"MDIMC": 8,"MWG": 32,"NDIMB": 32,"NDIMC": 32,"NWG": 32,"PRECISION": 32,"SA": 0,"SB": 0,"STRM": 0,"STRN": 0,"VWM": 4,"VWN": 1}
    },
    {
      "kernel": "Xgemm",
      "time": 2.214,
      "parameters": {"GEMMK": 0,"KREG": 1,"KWG": 32,"KWI": 2,"MDIMA": 8,"MDIMC": 8,"MWG": 32,"NDIMB": 32,"NDIMC": 32,"NWG": 32,"PRECISION": 32,"SA": 1,"SB": 1,"STRM": 0,"STRN": 0,"VWM": 4,"VWN": 1}
    },
    {
      "kernel": "Xgemm",
      "time": 2.204,
      "parameters": {"GEMMK": 0,"KREG": 1,"KWG": 32,"KWI": 2,"MDIMA": 16,"MDIMC": 16,"MWG": 32,"NDIMB": 8,"NDIMC": 8,"NWG": 32,"PRECISION": 32,"SA": 0,"SB": 0,"STRM": 0,"STRN": 0,"VWM": 1,"VWN": 1}
    },
    {
      "kernel": "Xgemm",
      "time": 1.321,
      "parameters": {"GEMMK": 0,"KREG": 1,"KWG": 32,"KWI": 2,"MDIMA": 16,"MDIMC": 16,"MWG": 32,"NDIMB": 8,"NDIMC": 8,"NWG": 32,"PRECISION": 32,"SA": 1,"SB": 1,"STRM": 0,"STRN": 0,"VWM": 1,"VWN": 1}
    },
    {
      "kernel": "Xgemm",
      "time": 2.979,
      "parameters": {"GEMMK": 0,"KREG": 1,"KWG": 32,"KWI": 2,"MDIMA": 16,"MDIMC": 16,"MWG": 32,"NDIMB": 8,"NDIMC": 8,"NWG": 32,"PRECISION": 32,"SA": 0,"SB": 0,"STRM": 0,"STRN": 0,"VWM": 1,"VWN": 2}
    },
    {
      "kernel": "Xgemm",
      "time": 1.717,
      "parameters": {"GEMMK": 0,"KREG": 1,"KWG": 32,"KWI": 2,"MDIMA": 16,"MDIMC": 16,"MWG": 32,"NDIMB": 8,"NDIMC": 8,"NWG": 32,"PRECISION": 32,"SA": 1,"SB": 1,"STRM": 0,"STRN": 0,"VWM": 1,"VWN": 2}
    },
    {
      "kernel": "Xgemm",
      "time": 1.522,
      "parameters": {"GEMMK": 0,"KREG": 1,"KWG": 32,"KWI": 2,"MDIMA": 16,"MDIMC": 16,"MWG": 32,"NDIMB": 8,"NDIMC": 8,"NWG": 32,"PRECISION": 32,"SA": 0,"SB": 0,"STRM": 0,"STRN": 0,"VWM": 1,"VWN": 4}
    },
    {
      "kernel": "Xgemm",
      "time": 1.693,
      "parameters": {"GEMMK": 0,"KREG": 1,"KWG": 32,"KWI": 2,"MDIMA": 16,"MDIMC": 16,"MWG": 32,"NDIMB": 8,"NDIMC": 8,"NWG": 32,"PRECISION": 32,"SA": 1,"SB": 1,"STRM": 0,"STRN": 0,"VWM": 1,"VWN": 4}
    },
    {
      "kernel": "Xgemm",
      "time": 5.907,
      "parameters": {"GEMMK": 0,"KREG": 1,"KWG": 32,"KWI": 2,"MDIMA": 16,"MDIMC": 16,"MWG": 32,"NDIMB": 8,"NDIMC": 8,"NWG": 32,"PRECISION": 32,"SA": 0,"SB": 0,"STRM": 0,"STRN": 0,"VWM": 2,"VWN": 1}
    },
    {
      "kernel": "Xgemm",
      "time": 2.693,
      "parameters": {"GEMMK": 0,"KREG": 1,"KWG": 32,"KWI": 2,"MDIMA": 16,"MDIMC": 16,"MWG": 32,"NDIMB": 8,"NDIMC": 8,"NWG": 32,"PRECISION": 32,"SA": 1,"SB": 1,"STRM": 0,"STRN": 0,"VWM": 2,"VWN": 1}
    },
    {
      "kernel": "Xgemm",
      "time": 4.260,
      "parameters": {"GEMMK": 0,"KREG": 1,"KWG": 32,"KWI": 2,"MDIMA": 16,"MDIMC": 16,"MWG": 32,"NDIMB": 8,"NDIMC": 8,"NWG": 32,"PRECISION": 32,"SA": 0,"SB": 0,"STRM": 0,"STRN": 0,"VWM": 2,"VWN": 2}
    },
    {
      "kernel": "Xgemm",
      "time": 2.368,
      "parameters": {"GEMMK": 0,"KREG": 1,"KWG": 32,"KWI": 2,"MDIMA": 16,"MDIMC": 16,"MWG": 32,"NDIMB": 8,"NDIMC": 8,"NWG": 32,"PRECISION": 32,"SA": 1,"SB": 1,"STRM": 0,"STRN": 0,"VWM": 2,"VWN": 2}
    },
    {
      "kernel": "Xgemm",
      "time": 3.221,
      "parameters": {"GEMMK": 0,"KREG": 1,"KWG": 32,"KWI": 2,"MDIMA": 16,"MDIMC": 16,"MWG": 32,"NDIMB": 8,"NDIMC": 8,"NWG": 32,"PRECISION": 32,"SA": 0,"SB": 0,"STRM": 0,"STRN": 0,"VWM": 2,"VWN": 4}
    },
    {
      "kernel": "Xgemm",
      "time": 2.522,
      "parameters": {"GEMMK": 0,"KREG": 1,"KWG": 32,"KWI": 2,"MDIMA": 16,"MDIMC": 16,"MWG": 32,"NDIMB": 8,"NDIMC": 8,"NWG": 32,"PRECISION": 32,"SA": 1,"SB": 1,"STRM": 0,"STRN": 0,"VWM": 2,"VWN": 4}
    },
    {
      "kernel": "Xgemm",
      "time": 4.235,
      "parameters": {"GEMMK": 0,"KREG": 1,"KWG": 32,"KWI": 2,"MDIMA": 16,"MDIMC": 16,"MWG": 32,"NDIMB": 16,"NDIMC": 16,"NWG": 32,"PRECISION": 32,"SA": 0,"SB": 0,"STRM": 0,"STRN": 0,"VWM": 1,"VWN": 1}
    },
    {
      "kernel": "Xgemm",
      "time": 1.566,
      "parameters": {"GEMMK": 0,"KREG": 1,"KWG": 32,"KWI": 2,"MDIMA": 16,"MDIMC": 16,"MWG": 32,"NDIMB": 16,"NDIMC": 16,"NWG": 32,"PRECISION": 32,"SA": 1,"SB": 1,"STRM": 0,"STRN": 0,"VWM": 1,"VWN": 1}
    },
    {
      "kernel": "Xgemm",
      "time": 1.827,
      "parameters": {"GEMMK": 0,"KREG": 1,"KWG": 32,"KWI": 2,"MDIMA": 16,"MDIMC": 16,"MWG": 32,"NDIMB": 16,"NDIMC": 16,"NWG": 32,"PRECISION": 32,"SA": 0,"SB": 0,"STRM": 0,"STRN": 0,"VWM": 1,"VWN": 2}
    },
    {
      "kernel": "Xgemm",
      "time": 3.001,
      "parameters": {"GEMMK": 0,"KREG": 1,"KWG": 32,"KWI": 2,"MDIMA": 16,"MDIMC": 16,"MWG": 32,"NDIMB": 16,"NDIMC": 16,"NWG": 32,"PRECISION": 32,"SA": 1,"SB": 1,"STRM": 0,"STRN": 0,"VWM": 1,"VWN": 2}
    },
    {
      "kernel": "Xgemm",
      "time": 2.060,
      "parameters": {"GEMMK": 0,"KREG": 1,"KWG": 32,"KWI": 2,"MDIMA": 16,"MDIMC": 16,"MWG": 32,"NDIMB": 16,"NDIMC": 16,"NWG": 32,"PRECISION": 32,"SA": 0,"SB": 0,"STRM": 0,"STRN": 0,"VWM": 2,"VWN": 1}
    },
    {
      "kernel": "Xgemm",
      "time": 1.920,
      "parameters": {"GEMMK": 0,"KREG": 1,"KWG": 32,"KWI": 2,"MDIMA": 16,"MDIMC": 16,"MWG": 32,"NDIMB": 16,"NDIMC": 16,"NWG": 32,"PRECISION": 32,"SA": 1,"SB": 1,"STRM": 0,"STRN": 0,"VWM": 2,"VWN": 1}
    },
    {
      "kernel": "Xgemm",
      "time": 2.789,
      "parameters": {"GEMMK": 0,"KREG": 1,"KWG": 32,"KWI": 2,"MDIMA": 16,"MDIMC": 16,"MWG": 32,"NDIMB": 16,"NDIMC": 16,"NWG": 32,"PRECISION": 32,"SA": 0,"SB": 0,"STRM": 0,"STRN": 0,"VWM": 2,"VWN": 2}
    },
    {
      "kernel": "Xgemm",
      "time": 2.333,
      "parameters": {"GEMMK": 0,"KREG": 1,"KWG": 32,"KWI": 2,"MDIMA": 16,"MDIMC": 16,"MWG": 32,"NDIMB": 16,"NDIMC": 16,"NWG": 32,"PRECISION": 32,"SA": 1,"SB": 1,"STRM": 0,"STRN": 0,"VWM": 2,"VWN": 2}
    },
    {
      "kernel": "Xgemm",
      "time": 2.186,
      "parameters": {"GEMMK": 0,"KREG": 1,"KWG": 32,"KWI": 2,"MDIMA": 32,"MDIMC": 32,"MWG": 32,"NDIMB": 8,"NDIMC": 8,"NWG": 32,"PRECISION": 32,"SA": 0,"SB": 0,"STRM": 0,"STRN": 0,"VWM": 1,"VWN": 1}
    },
    {
      "kernel": "Xgemm",
      "time": 2.491,
      "parameters": {"GEMMK": 0,"KREG": 1,"KWG": 32,"KWI": 2,"MDIMA": 32,"MDIMC": 32,"MWG": 32,"NDIMB": 8,"NDIMC": 8,"NWG": 32,"PRECISION": 32,"SA": 1,"SB": 1,"STRM": 0,"STRN": 0,"VWM": 1,"VWN": 1}
    },
    {
      "kernel": "Xgemm",
      "time": 1.983,
      "parameters": {"GEMMK": 0,"KREG": 1,"KWG": 32,"KWI": 2,"MDIMA": 32,"MDIMC": 32,"MWG": 32,"NDIMB": 8,"NDIMC": 8,"NWG": 32,"PRECISION": 32,"SA": 0,"SB": 0,"STRM": 0,"STRN": 0,"VWM": 1,"VWN": 2}
    },
    {
      "kernel": "Xgemm",
      "time": 2.027,
      "parameters": {"GEMMK": 0,"KREG": 1,"KWG": 32,"KWI": 2,"MDIMA": 32,"MDIMC": 32,"MWG": 32,"NDIMB": 8,"NDIMC": 8,"NWG": 32,"PRECISION": 32,"SA": 1,"SB": 1,"STRM": 0,"STRN": 0,"VWM": 1,"VWN": 2}
    },
    {
      "kernel": "Xgemm",
      "time": 3.571,
      "parameters": {"GEMMK": 0,"KREG": 1,"KWG": 32,"KWI": 2,"MDIMA": 32,"MDIMC": 32,"MWG": 32,"NDIMB": 8,"NDIMC": 8,"NWG": 32,"PRECISION": 32,"SA": 0,"SB": 0,"STRM": 0,"STRN": 0,"VWM": 1,"VWN": 4}
    },
    {
      "kernel": "Xgemm",
      "time": 1.921,
      "parameters": {"GEMMK": 0,"KREG": 1,"KWG": 32,"KWI": 2,"MDIMA": 32,"MDIMC": 32,"MWG": 32,"NDIMB": 8,"NDIMC": 8,"NWG": 32,"PRECISION": 32,"SA": 1,"SB": 1,"STRM": 0,"STRN": 0,"VWM": 1,"VWN": 4}
    },
    {
      "kernel": "Xgemm",
      "time": 2.173,
      "parameters": {"GEMMK": 0,"KREG": 1,"KWG": 32,"KWI": 2,"MDIMA": 8,"MDIMC": 8,"MWG": 32,"NDIMB": 8,"NDIMC": 8,"NWG": 64,"PRECISION": 32,"SA": 0,"SB": 0,"STRM": 0,"STRN": 0,"VWM": 1,"VWN": 1}
    },
    {
      "kernel": "Xgemm",
      "time": 2.786,
      "parameters": {"GEMMK": 0,"KREG": 1,"KWG": 32,"KWI": 2,"MDIMA": 8,"MDIMC": 8,"MWG": 32,"NDIMB": 8,"NDIMC": 8,"NWG": 64,"PRECISION": 32,"SA": 1,"SB": 1,"STRM": 0,"STRN": 0,"VWM": 1,"VWN": 1}
    },
    {
      "kernel": "Xgemm",
      "time": 3.368,
      "parameters": {"GEMMK": 0,"KREG": 1,"KWG": 32,"KWI": 2,"MDIMA": 8,"MDIMC": 8,"MWG": 32,"NDIMB": 8,"NDIMC": 8,"NWG": 64,"PRECISION": 32,"SA": 0,"SB": 0,"STRM": 0,"STRN": 0,"VWM": 1,"VWN": 2}
    },
    {
      "kernel": "Xgemm",
      "time": 1.430,
      "parameters": {"GEMMK": 0,"KREG": 1,"KWG": 32,"KWI": 2,"MDIMA": 8,"MDIMC": 8,"MWG": 32,"NDIMB": 8,"NDIMC": 8,"NWG": 64,"PRECISION": 32,"SA": 1,"SB": 1,"STRM": 0,"STRN": 0,"VWM": 1,"VWN": 2}
    },
    {
      "kernel": "Xgemm",
      "time": 1.687,
      "parameters": {"GEMMK": 0,"KREG": 1,"KWG": 32,"KWI": 2,"MDIMA": 8,"MDIMC": 8,"MWG": 32,"NDIMB": 8,"NDIMC": 8,"NWG": 64,"PRECISION": 32,"SA": 0,"SB": 0,"STRM": 0,"STRN": 0,"VWM": 1,"VWN": 4}
    },
    {
      "kernel": "Xgemm",
      "time": 2.763,
      "parameters": {"GEMMK": 0,"KREG": 1,"KWG": 32,"KWI": 2,"MDIMA": 8,"MDIMC": 8,"MWG": 32,"NDIMB": 8,"NDIMC": 8,"NWG": 64,"PRECISION": 32,"SA": 1,"SB": 1,"STRM": 0,"STRN": 0,"VWM": 1,"VWN": 4}
    },
    {
      "kernel": "Xgemm",
      "time": 2.772,
      "parameters": {"GEMMK": 0,"KREG": 1,"KWG": 32,"KWI": 2,"MDIMA": 8,"MDIMC": 8,"MWG": 32,"NDIMB": 8,"NDIMC": 8,"NWG": 64,"PRECISION": 32,"SA": 0,"SB": 0,"STRM": 0,"STRN": 0,"VWM": 2,"VWN": 1}
    },
    {
      "kernel": "Xgemm",
      "time": 1.485,
      "parameters": {"GEMMK": 0,"KREG": 1,"KWG": 32,"KWI": 2,"MDIMA": 8,"MDIMC": 8,"MWG": 32,"NDIMB": 8,"NDIMC": 8,"NWG": 64,"PRECISION": 32,"SA": 1,"SB": 1,"STRM": 0,"STRN": 0,"VWM": 2,"VWN": 1}
    },
    {
      "kernel": "Xgemm",
      "time": 2.063,
      "parameters": {"GEMMK": 0,"KREG": 1,"KWG": 32,"KWI": 2,"MDIMA": 8,"MDIMC": 8,"MWG": 32,"NDIMB": 8,"NDIMC": 8,"NWG": 64,"PRECISION": 32,"SA": 0,"SB": 0,"STRM": 0,"STRN": 0,"VWM": 2,"VWN": 2}
    },
    {
      "kernel": "Xgemm",
      "time": 2.644,
      "parameters": {"GEMMK": 0,"KREG": 1,"KWG": 32,"KWI": 2,"MDIMA": 8,"MDIMC": 8,"MWG": 32,"NDIMB": 8,"NDIMC": 8,"NWG": 64,"PRECISION": 32,"SA": 1,"SB": 1,"STRM": 0,"STRN": 0,"VWM": 2,"VWN": 2}
    },
    {
      "kernel": "Xgemm",
      "time": 1.799,
      "parameters": {"GEMMK": 0,"KREG": 1,"KWG": 32,"KWI": 2,"MDIMA": 8,"MDIMC": 8,"MWG": 32,"NDIMB": 8,"NDIMC": 8,"NWG": 64,"PRECISION": 32,"SA": 0,"SB": 0,"STRM": 0,"STRN": 0,"VWM": 2,"VWN": 4}
    },
    {
      "kernel": "Xgemm",
      "time": 1.689,
      "parameters": {"GEMMK": 0,"KREG": 1,"KWG": 32,"KWI": 2,"MDIMA": 8,"MDIMC": 8,"MWG": 32,"NDIMB": 8,"NDIMC": 8,"NWG": 64,"PRECISION": 32,"SA": 1,"SB": 1,"STRM": 0,"STRN": 0,"VWM": 2,"VWN": 4}
    },
    {
      "kernel": "Xgemm",
      "time": 3.170,
      "parameters": {"GEMMK": 0,"KREG": 1,"KWG": 32,"KWI": 2,"MDIMA": 8,"MDIMC": 8,"MWG": 32,"NDIMB": 8,"NDIMC": 8,"NWG": 64,"PRECISION": 32,"SA": 0,"SB": 0,"STRM": 0,"STRN": 0,"VWM": 4,"VWN": 1}
    },
    {
      "kernel": "Xgemm",
      "time": 2.728,
      "parameters": {"GEMMK": 0,"KREG": 1,"KWG": 32,"KWI": 2,"MDIMA": 8,"MDIMC": 8,"MWG": 32,"NDIMB": 8,"NDIMC": 8,"NWG": 64,"PRECISION": 32,"SA": 1,"SB": 1,"STRM": 0,"STRN": 0,"VWM": 4,"VWN": 1}
    },
    {
      "kernel": "Xgemm",
      "time": 3.471,
      "parameters": {"GEMMK": 0,"KREG": 1,"KWG": 32,"KWI": 2,"MDIMA": 8,"MDIMC": 8,"MWG": 32,"NDIMB": 8,"NDIMC": 8,"NWG": 64,"PRECISION": 32,"SA": 0,"SB": 0,"STRM": 0,"STRN": 0,"VWM": 4,"VWN": 2}
    },
    {
      "kernel": "Xgemm",
      "time": 2.618,
      "parameters": {"GEMMK": 0,"KREG": 1,"KWG": 32,"KWI": 2,"MDIMA": 8,"MDIMC": 8,"MWG": 32,"NDIMB": 8,"NDIMC": 8,"NWG": 64,"PRECISION": 32,"SA": 1,"SB": 1,"STRM": 0,"STRN": 0,"VWM": 4,"VWN": 2}
    },
    {
      "kernel": "Xgemm",
      "time": 1.789,
      "parameters": {"GEMMK": 0,"KREG": 1,"KWG": 32,"KWI": 2,"MDIMA": 8,"MDIMC": 8,"MWG": 32,"NDIMB": 8,"NDIMC": 8,"NWG": 64,"PRECISION": 32,"SA": 0,"SB": 0,"STRM": 0,"STRN": 0,"VWM": 4,"VWN": 4}
    },
    {
      "kernel": "Xgemm",
      "time": 1.448,
      "parameters": {"GEMMK": 0,"KREG": 1,"KWG": 32,"KWI": 2,"MDIMA": 8,"MDIMC": 8,"MWG": 32,"NDIMB": 8,"NDIMC": 8,"NWG": 64,"PRECISION": 32,"SA": 1,"SB": 1,"STRM": 0,"STRN": 0,"VWM": 4,"VWN": 4}
    },
    {
      "kernel": "Xgemm",
      "time": 2.431,
      "parameters": {"GEMMK": 0,"KREG": 1,"KWG": 32,"KWI": 2,"MDIMA": 8,"MDIMC": 8,"MWG": 32,"NDIMB": 16,"NDIMC": 16,"NWG": 64,"PRECISION": 32,"SA": 0,"SB": 0,"STRM": 0,"STRN": 0,"VWM": 1,"VWN": 1}
    },
    {
      "kernel": "Xgemm",
      "time": 2.705,
      "parameters": {"GEMMK": 0,"KREG": 1,"KWG": 32,"KWI": 2,"MDIMA": 8,"MDIMC": 8,"MWG": 32,"NDIMB": 16,"NDIMC": 16,"NWG": 64,"PRECISION": 32,"SA": 1,"SB": 1,"STRM": 0,"STRN": 0,"VWM": 1,"VWN": 1}
    },
    {
      "kernel": "Xgemm",
      "time": 4.159,
      "parameters": {"GEMMK": 0,"KREG": 1,"KWG": 32,"KWI": 2,"MDIMA": 8,"MDIMC": 8,"MWG": 32,"NDIMB": 16,"NDIMC": 16,"NWG": 64,"PRECISION": 32,"SA": 0,"SB": 0,"STRM": 0,"STRN": 0,"VWM": 1,"VWN": 2}
    },
    {
      "kernel": "Xgemm",
      "time": 2.636,
      "parameters": {"GEMMK": 0,"KREG": 1,"KWG": 32,"KWI": 2,"MDIMA": 8,"MDIMC": 8,"MWG": 32,"NDIMB": 16,"NDIMC": 16,"NWG": 64,"PRECISION": 32,"SA": 1,"SB": 1,"STRM": 0,"STRN": 0,"VWM": 1,"VWN": 2}
    },
    {
      "kernel": "Xgemm",
      "time": 4.067,
      "parameters": {"GEMMK": 0,"KREG": 1,"KWG": 32,"KWI": 2,"MDIMA": 8,"MDIMC": 8,"MWG": 32,"NDIMB": 16,"NDIMC": 16,"NWG": 64,"PRECISION": 32,"SA": 0,"SB": 0,"STRM": 0,"STRN": 0,"VWM": 1,"VWN": 4}
    },
    {
      "kernel": "Xgemm",
      "time": 2.647,
      "parameters": {"GEMMK": 0,"KREG": 1,"KWG": 32,"KWI": 2,"MDIMA": 8,"MDIMC": 8,"MWG": 32,"NDIMB": 16,"NDIMC": 16,"NWG": 64,"PRECISION": 32,"SA": 1,"SB": 1,"STRM": 0,"STRN": 0,"VWM": 1,"VWN": 4}
    },
    {
      "kernel": "Xgemm",
      "time": 2.993,
      "parameters": {"GEMMK": 0,"KREG": 1,"KWG": 32,"KWI": 2,"MDIMA": 8,"MDIMC": 8,"MWG": 32,"NDIMB": 16,"NDIMC": 16,"NWG": 64,"PRECISION": 32,"SA": 0,"SB": 0,"STRM": 0,"STRN": 0,"VWM": 2,"VWN": 1}
    },
    {
      "kernel": "Xgemm",
      "time": 1.400,
      "parameters": {"GEMMK": 0,"KREG": 1,"KWG": 32,"KWI": 2,"MDIMA": 8,"MDIMC": 8,"MWG": 32,"NDIMB": 16,"NDIMC": 16,"NWG": 64,"PRECISION": 32,"SA": 1,"SB": 1,"STRM": 0,"STRN": 0,"VWM": 2,"VWN": 1}
    },
    {
      "kernel": "Xgemm",
      "time": 2.545,
      "parameters": {"GEMMK": 0,"KREG": 1,"KWG": 32,"KWI": 2,"MDIMA": 8,"MDIMC": 8,"MWG": 32,"NDIMB": 16,"NDIMC": 16,"NWG": 64,"PRECISION": 32,"SA": 0,"SB": 0,"STRM": 0,"STRN": 0,"VWM": 2,"VWN": 2}
    },
    {
      "kernel": "Xgemm",
      "time": 2.721,
      "parameters": {"GEMMK": 0,"KREG": 1,"KWG": 32,"KWI": 2,"MDIMA": 8,"MDIMC": 8,"MWG": 32,"NDIMB": 16,"NDIMC": 16,"NWG": 64,"PRECISION": 32,"SA": 1,"SB": 1,"STRM": 0,"STRN": 0,"VWM": 2,"VWN": 2}
    },
    {
      "kernel": "Xgemm",
      "time": 4.089,
      "parameters": {"GEMMK": 0,"KREG": 1,"KWG": 32,"KWI": 2,"MDIMA": 8,"MDIMC": 8,"MWG": 32,"NDIMB": 16,"NDIMC": 16,"NWG": 64,"PRECISION": 32,"SA": 0,"SB": 0,"STRM": 0,"STRN": 0,"VWM": 2,"VWN": 4}
    },
    {
      "kernel": "Xgemm",
      "time": 2.647,
      "parameters": {"GEMMK": 0,"KREG": 1,"KWG": 32,"KWI": 2,"MDIMA": 8,"MDIMC": 8,"MWG": 32,"NDIMB": 16,"NDIMC": 16,"NWG": 64,"PRECISION": 32,"SA": 1,"SB": 1,"STRM": 0,"STRN": 0,"VWM": 2,"VWN": 4}
    },
    {
      "kernel": "Xgemm",
      "time": 3.421,
      "parameters": {"GEMMK": 0,"KREG": 1,"KWG": 32,"KWI": 2,"MDIMA": 8,"MDIMC": 8,"MWG": 32,"NDIMB": 16,"NDIMC": 16,"NWG": 64,"PRECISION": 32,"SA": 0,"SB": 0,"STRM": 0,"STRN": 0,"VWM": 4,"VWN": 1}
    },
    {
      "kernel": "Xgemm",
      "time": 1.417,
      "parameters": {"GEMMK": 0,"KREG": 1,"KWG": 32,"KWI": 2,"MDIMA": 8,"MDIMC": 8,"MWG": 32,"NDIMB": 16,"NDIMC": 16,"NWG": 64,"PRECISION": 32,"SA": 1,"SB": 1,"STRM": 0,"STRN": 0,"VWM": 4,"VWN": 1}
    },
    {
      "kernel": "Xgemm",
      "time": 3.123,
      "parameters": {"GEMMK": 0,"KREG": 1,"KWG": 32,"KWI": 2,"MDIMA": 8,"MDIMC": 8,"MWG": 32,"NDIMB": 16,"NDIMC": 16,"NWG": 64,"PRECISION": 32,"SA": 0,"SB": 0,"STRM": 0,"STRN": 0,"VWM": 4,"VWN": 2}
    },
    {
      "kernel": "Xgemm",
      "time": 2.590,
      "parameters": {"GEMMK": 0,"KREG": 1,"KWG": 32,"KWI": 2,"MDIMA": 8,"MDIMC": 8,"MWG": 32,"NDIMB": 16,"NDIMC": 16,"NWG": 64,"PRECISION": 32,"SA": 1,"SB": 1,"STRM": 0,"STRN": 0,"VWM": 4,"VWN": 2}
    },
    {
      "kernel": "Xgemm",
      "time": 2.266,
      "parameters": {"GEMMK": 0,"KREG": 1,"KWG": 32,"KWI": 2,"MDIMA": 8,"MDIMC": 8,"MWG": 32,"NDIMB": 16,"NDIMC": 16,"NWG": 64,"PRECISION": 32,"SA": 0,"SB": 0,"STRM": 0,"STRN": 0,"VWM": 4,"VWN": 4}
    },
    {
      "kernel": "Xgemm",
      "time": 1.123,
      "parameters": {"GEMMK": 0,"KREG": 1,"KWG": 32,"KWI": 2,"MDIMA": 8,"MDIMC": 8,"MWG": 32,"NDIMB": 16,"NDIMC": 16,"NWG": 64,"PRECISION": 32,"SA": 1,"SB": 1,"STRM": 0,"STRN": 0,"VWM": 4,"VWN": 4}
    },
    {
      "kernel": "Xgemm",
      "time": 2.122,
      "parameters": {"GEMMK": 0,"KREG": 1,"KWG": 32,"KWI": 2,"MDIMA": 8,"MDIMC": 8,"MWG": 32,"NDIMB": 32,"NDIMC": 32,"NWG": 64,"PRECISION": 32,"SA": 0,"SB": 0,"STRM": 0,"STRN": 0,"VWM": 1,"VWN": 1}
    },
    {
      "kernel": "Xgemm",
      "time": 2.984,
      "parameters": {"GEMMK": 0,"KREG": 1,"KWG": 32,"KWI": 2,"MDIMA": 8,"MDIMC": 8,"MWG": 32,"NDIMB": 32,"NDIMC": 32,"NWG": 64,"PRECISION": 32,"SA": 1,"SB": 1,"STRM": 0,"STRN": 0,"VWM": 1,"VWN": 1}
    },
    {
      "kernel": "Xgemm",
      "time": 2.738,
      "parameters": {"GEMMK": 0,"KREG": 1,"KWG": 32,"KWI": 2,"MDIMA": 8,"MDIMC": 8,"MWG": 32,"NDIMB": 32,"NDIMC": 32,"NWG": 64,"PRECISION": 32,"SA": 0,"SB": 0,"STRM": 0,"STRN": 0,"VWM": 1,"VWN": 2}
    },
    {
      "kernel": "Xgemm",
      "time": 1.339,
      "parameters": {"GEMMK": 0,"KREG": 1,"KWG": 32,"KWI": 2,"MDIMA": 8,"MDIMC": 8,"MWG": 32,"NDIMB": 32,"NDIMC": 32,"NWG": 64,"PRECISION": 32,"SA": 1,"SB": 1,"STRM": 0,"STRN": 0,"VWM": 1,"VWN": 2}
    },
    {
      "kernel": "Xgemm",
      "time": 1.814,
      "parameters": {"GEMMK": 0,"KREG": 1,"KWG": 32,"KWI": 2,"MDIMA": 8,"MDIMC": 8,"MWG": 32,"NDIMB": 32,"NDIMC": 32,"NWG": 64,"PRECISION": 32,"SA": 0,"SB": 0,"STRM": 0,"STRN": 0,"VWM": 2,"VWN": 1}
    },
    {
      "kernel": "Xgemm",
      "time": 2.621,
      "parameters": {"GEMMK": 0,"KREG": 1,"KWG": 32,"KWI": 2,"MDIMA": 8,"MDIMC": 8,"MWG": 32,"NDIMB": 32,"NDIMC": 32,"NWG": 64,"PRECISION": 32,"SA": 1,"SB": 1,"STRM": 0,"STRN": 0,"VWM": 2,"VWN": 1}
    },
    {
      "kernel": "Xgemm",
      "time": 2.629,
      "parameters": {"GEMMK": 0,"KREG": 1,"KWG": 32,"KWI": 2,"MDIMA": 8,"MDIMC": 8,"MWG": 32,"NDIMB": 32,"NDIMC": 32,"NWG": 64,"PRECISION": 32,"SA": 0,"SB": 0,"STRM": 0,"STRN": 0,"VWM": 2,"VWN": 2}
    },
    {
      "kernel": "Xgemm",
      "time": 1.381,
      "parameters": {"GEMMK": 0,"KREG": 1,"KWG": 32,"KWI": 2,"MDIMA": 8,"MDIMC": 8,"MWG": 32,"NDIMB": 32,"NDIMC": 32,"NWG": 64,"PRECISION": 32,"SA": 1,"SB": 1,"STRM": 0,"STRN": 0,"VWM": 2,"VWN": 2}
    },
    {
      "kernel": "Xgemm",
      "time": 3.044,
      "parameters": {"GEMMK": 0,"KREG": 1,"KWG": 32,"KWI": 2,"MDIMA": 8,"MDIMC": 8,"MWG": 32,"NDIMB": 32,"NDIMC": 32,"NWG": 64,"PRECISION": 32,"SA": 0,"SB": 0,"STRM": 0,"STRN": 0,"VWM": 4,"VWN": 1}
    },
    {
      "kernel": "Xgemm",
      "time": 2.718,
      "parameters": {"GEMMK": 0,"KREG": 1,"KWG": 32,"KWI": 2,"MDIMA": 8,"MDIMC": 8,"MWG": 32,"NDIMB": 32,"NDIMC": 32,"NWG": 64,"PRECISION": 32,"SA": 1,"SB": 1,"STRM": 0,"STRN": 0,"VWM": 4,"VWN": 1}
    },
    {
      "kernel": "Xgemm",
      "time": 4.606,
      "parameters": {"GEMMK": 0,"KREG": 1,"KWG": 32,"KWI": 2,"MDIMA": 8,"MDIMC": 8,"MWG": 32,"NDIMB": 32,"NDIMC": 32,"NWG": 64,"PRECISION": 32,"SA": 0,"SB": 0,"STRM": 0,"STRN": 0,"VWM": 4,"VWN": 2}
    },
    {
      "kernel": "Xgemm",
      "time": 2.621,
      "parameters": {"GEMMK": 0,"KREG": 1,"KWG": 32,"KWI": 2,"MDIMA": 8,"MDIMC": 8,"MWG": 32,"NDIMB": 32,"NDIMC": 32,"NWG": 64,"PRECISION": 32,"SA": 1,"SB": 1,"STRM": 0,"STRN": 0,"VWM": 4,"VWN": 2}
    },
    {
      "kernel": "Xgemm",
      "time": 2.943,
      "parameters": {"GEMMK": 0,"KREG": 1,"KWG": 32,"KWI": 2,"MDIMA": 16,"MDIMC": 16,"MWG": 32,"NDIMB": 8,"NDIMC": 8,"NWG": 64,"PRECISION": 32,"SA": 0,"SB": 0,"STRM": 0,"STRN": 0,"VWM": 1,"VWN": 1}
    },
    {
      "kernel": "Xgemm",
      "time": 1.789,
      "parameters": {"GEMMK": 0,"KREG": 1,"KWG": 32,"KWI": 2,"MDIMA": 16,"MDIMC": 16,"MWG": 32,"NDIMB": 8,"NDIMC": 8,"NWG": 64,"PRECISION": 32,"SA": 1,"SB": 1,"STRM": 0,"STRN": 0,"VWM": 1,"VWN": 1}
    },
    {
      "kernel": "Xgemm",
      "time": 2.568,
      "parameters": {"GEMMK": 0,"KREG": 1,"KWG": 32,"KWI": 2,"MDIMA": 16,"MDIMC": 16,"MWG": 32,"NDIMB": 8,"NDIMC": 8,"NWG": 64,"PRECISION": 32,"SA": 0,"SB": 0,"STRM": 0,"STRN": 0,"VWM": 1,"VWN": 2}
    },
    {
      "kernel": "Xgemm",
      "time": 1.717,
      "parameters": {"GEMMK": 0,"KREG": 1,"KWG": 32,"KWI": 2,"MDIMA": 16,"MDIMC": 16,"MWG": 32,"NDIMB": 8,"NDIMC": 8,"NWG": 64,"PRECISION": 32,"SA": 1,"SB": 1,"STRM": 0,"STRN": 0,"VWM": 1,"VWN": 2}
    },
    {
      "kernel": "Xgemm",
      "time": 3.002,
      "parameters": {"GEMMK": 0,"KREG": 1,"KWG": 32,"KWI": 2,"MDIMA": 16,"MDIMC": 16,"MWG": 32,"NDIMB": 8,"NDIMC": 8,"NWG": 64,"PRECISION": 32,"SA": 0,"SB": 0,"STRM": 0,"STRN": 0,"VWM": 1,"VWN": 4}
    },
    {
      "kernel": "Xgemm",
      "time": 2.804,
      "parameters": {"GEMMK": 0,"KREG": 1,"KWG": 32,"KWI": 2,"MDIMA": 16,"MDIMC": 16,"MWG": 32,"NDIMB": 8,"NDIMC": 8,"NWG": 64,"PRECISION": 32,"SA": 1,"SB": 1,"STRM": 0,"STRN": 0,"VWM": 1,"VWN": 4}
    },
    {
      "kernel": "Xgemm",
      "time": 3.631,
